NOME-INSTITUICAO-EMPRESA,QUANTIDADE
"UNIVERSIDADE DO ESTADO DO PARA, UEPA, SANTAREM",1
TRIBUNAL REGIONAL FEDERAL DA 2A REGIAO,1
INSTITUTO DE DESENVOLVIMENTO E EDUCACAO AMBIENTAL,1
CENTRO DE TERAPIA CELULAR - HEMOCENTRO DE RIBEIRAO PRETO,1
FACULDADE 7 DE SETEMBRO,1
SECRETARIA ESTADUAL DE SAUDE DO RIO DE JANEIRO,1
COLEGIO ESTADUAL AMAZONAS,1
AMARAL BODRA SOCIEDADE DE ADVOGADOS,1
INSTITUTO HOSPITAL DE BASE DO DF,1
PREFEITURA MUNICIPAL DE CAMPO BOM,1
IFCE MARACANAU,1
SECRETARIA DE ESTADO DE CULTURA DO DISTRITO FEDERAL,1
POLICLINICA PIQUET CARNEIRO,1
HELMHOLTZ ZENTRUM MUNICH,1
EETI LIBERALINA WEILL,1
INSTITUTO BRASILEIRO DE ESPECIALIDADES EM MEDICINA VETERINARIA,1
FUNDACAO PADRE ANTONIO DANTE CIVIERO,1
"INSTITUTO FEDERAL DE EDUCACAO, CIENCIA E TECNOLOGIA DO PARA - IFPA, CRMB",1
SECRETARIA DE ESTADO DE EDUCACAO (MS),1
SECRETARIA MUNICIPAL DE EDUCACAO - PMVR,1
HOSPITAL OESTE D'OR,1
UNIVERSIDADE FEDERAL DE SAO PAULO - HOSPITAL SAO PAULO,1
EMBRAPA TRIGO - CENTRO NACIONAL DE PESQUISA DE TRIGO,1
BW CONSULTORIA VETERINARIA,1
COLEGIO MARISTA NOSSA SENHORA DO ROSARIO - UNIAO SUL BRASILEIRA DE EDUCACAO,1
CENTRO UNIVERSITARIO UNIFMU,1
MEDINA E PICCININ ADVOGADOS ASSOCIADOS,1
CAMARA MUNICIPAL DE GUARAPUAVA,1
COLEGIO ESTADUAL PRESIDENTE ARTHUR DA COSTA E SILVA ENSINO FUNDAMENTAL E ME,1
FUNDACAO OSWALDO CRUZ - PE,1
RICARDO COHEN - CIRURGIA BARIATRICA,1
EMPRESA BRASILEIRA DE PESQUISA AGROPECUARIA/EMBRAPA - SEDE,1
INSTITUTO COGNORAMA,1
INSTITUTO DE EDUCACAO REGIS PACHECO,1
ESCOLA ANTONIO DE PADUA,1
INSTITUTO DE FISCIA TEORICA UNESP,1
HOSPITAL DAS CLINICAS DA FACULDADE DE MEDICINA DA UNVERSIDADE DE SAO PAULO,1
PREFEITURA MUINICIPAL DE MONTE MOR,1
INSTITUTO SENAI DE INOVACAO EM METALURGIA E LIGAS ESPECIAIS,1
HOSPITAL CRISTO REDENTOR,1
COLEGIO MARIA CLARA MACHADO,1
AFYA FACULDADE DE CIENCIAS MEDICAS DE PALMAS,1
CENTRO ESTUDOS AVANCADOS EM ECONOMIA APLICADA,1
PESQUISADORA INDEPENDENTE,1
HENRY FORD HEALTH,1
PREFEITURA MUNICIPAL DE SAO GONCALO DO SAPUCAI,1
FATEC SAO CAETANO DO SUL,1
COORDENADORIA DE CONTROLE DE DOENCAS DA SECRETARIA DE ESTADO DA SAUDE DE SA,1
SECRETARIA DE SAUDE MUNICIPAL DE BELEM,1
CENTRO POLITECNICO-UFPR,1
UNIVERSIDADE ESTADUAL DO SUDOESTE DA BAHIA/ ITAPETINGA,1
CIEP DR. ADAO PEREIRA NUNES,1
MCE ASSESSORIA E CONSULTORIA LTDA,1
INSTITUTO TANGANELI DE ODONTOLOGIA ESPECIALIZADA,1
DEPARTAMENTO DE ANTROPOLOGIA DA UNIVERSIDADE DE BRASILIA,1
ACADEMIA DE POLICIA MILITAR DO ESTADO DE GOIAS,1
INSTITUTO DE GEOCIENCIAS - UNICAMP,1
AGRIMUTUAL - SOLUCOES EM GERENCIAMENTO DE RISCO LTDA,1
NUCLEO DE PESQUISA EM DIREITOS HUMANOS E SAUDE DA POPULACAO LGBT+,1
SECRETARIA MUNICIPAL DE EDUCACAO DE FARROUPILHA/RS,1
ECOGEN BRASIL SOLUCOES ENERGETICAS,1
"INSTITUTO FEDERAL DE EDUCACAO, CIENCIA E TECNOLOGIA MINAS GERAIS ? IFMG",1
LETICIA NUNES,1
UNIVERSIDAD DEL VALLE - CAMPUS TIQUIPAYA,1
COLEGIO ESTADUAL JOHN KENNEDY,1
APMARQUES CONSULTORIA E CAPACITACAO EM ENGENHARIA ELETRICA,1
"INSTITUTO FEDERAL DE EDUCACAO, CIENCIA E TECNOLOGIA ? CAMPUS DE VITORIA DA",1
CENTRO DE ESPECIALIDADES EM ORTOPEDIA E TRAUMATOLOGIA,1
CENTRO DE ESTUDOS ODONTOLOGICOS,1
ONCOPLASTICA CLINICA DE MASTOLOGIA E CIRURGIA PLASTICA SS,1
UNIDADE ESCOLAR MIGUEL NUNES DE SALES,1
COLEGIO ESTADUAL ATTILIO CODATO,1
RAFAEL PANDOLFO ADVOGADOS ASSOCIADOS,1
"INSTITUTO FEDERAL DO TRIANGULO MINEIRO - IFTM, CAMPUS UBERABA, MG",1
ANTONIO TUFI ORTOPEDIA LTDA,1
CAMARA MUNICIPAL DE PRESIDENTE PRUDENTE,1
D-BLOCK PESQUISA EM NANOTECNOLOGIA,1
FUNDACAO HEMOPA - SETOR IMUNOGENETICA,1
FACULDADE DE PSICOLOGIA DO CEFI,1
PREFEITURA MUNICIPAL DA ESTANCIA BALNEARIA DE CARAGUATATUBA,1
CONSULTORIO PARTICULAR - CAETANO ORTODONTIA,1
HOSPITAL AC CAMARGO (HOSP DO CANCER),1
CENTRO UNIVERSITARIO CATOLICO DO LESTE DE MINAS GERAIS,1
UNIVERSIDAD CENTRAL MARTHA ABREUS DE LAS VILLAS,1
ESCOLA ESTADUAL PROFESSOR SALATIEL DE ALMEIDA DE MUZAMBINHO,1
INSTITUTO FEDERAL DE SANTA CATARINA-CAMPUS CONCORDIA,1
INSTITUTO FEDERAL DE GOIAS - IFG,1
INSTITUTO DE PESOS E MEDIDAS DE SAO PAULO,1
MOS SOCIEDADE DE ADVOGADOS,1
VECCHIO SOCIEDADE INDIVIDUAL DE ADVOCACIA,1
PRIME ODONTO,1
"INSTITUTO FEDERAL DE EDUCACAO, CIENCIA E TECNOLOGIA DO PARA, ITAITUBA",1
JUSTICA FEDERAL NA PARAIBA,1
PREFEITURA MUNICIPAL DE JACARACI BA,1
PREFEITURA DE SANTA BARBARA DOESTE,1
STANCE DUAL SCHOOL,1
POLICIA CIENTIFICA - PR,1
CANAA CONSULTORIA EMPRESARIAL,1
PREFEITURA MUNICIPAL DE GARUVA,1
FUNDACAO DE ASSISTENCIA INTEGRAL A SAUDE,1
LAMEIRA E BUARQUE INSTITUTO ODONTOLOGICO,1
INSTITUTO FEDERAL DE EDUCACAO CIENCIA E TECNOLOGIA BAIANO - CAMPUS GUANAMBI,1
GN ATIVIDADES VETERINARIAS E SERVICOS ADMINISTRATIVOS LTDA,1
UNIVERSIDADE DO ESTADO DO RIO DE JANEIRO FACULDADE DE FORMACAO DE PROFESSOR,1
CENTRO DE ATENCAO PSICOSSOCIAL GUITO GUIGO,1
V. MARTINIUK SOCIEDADE INDIVIDUAL DE ADVOCACIA,1
CBRE,1
PROURO - UROLOGIA E PROCTOLOGIA,1
ORG GRAZIANO,1
ESCOLA ESTADUAL PROFESSOR CANDIDO DUARTE,1
ALDIR MACHADO ODONTOLOGIA LTDA,1
CENTRO DE IMPLANTOLOGIA ORAL,1
UNIVERSIDADE DO OESTE DO ESTADO DO PARANA,1
CONSULTORIO CLINICO PARTICULAR,1
UNIVERSIDADE ESTADUAL DE GOIAS - UNIDADE UNIVERSITARIA DE QUIRINOPOLIS,1
COLEGIO ESTADUAL MONSENHOR TURIBIO VILANOVA,1
MIKHAEL FERREIRA ENGENHARIA,1
UFMG - FACULDADE DE MEDICINA,1
ESCOLA DE MEDICINA VETERINARIA E ZOOTECNIA,1
INSTITUTO FEDERAL DE EDUCACAO CIENCIA E TECNOLOGIA - CAMPUS CRATO,1
UNIVERSITY OF FEDERAL RIO DE JANEIRO,1
ESPACO FLORES ASTRAIS,1
CLINICA MULLER,1
PETROLEO BRASILEIRO SA,1
"INSTITUT NATIONAL DE RECHERCHE POUR L?AGRICULTURE,",1
SCAFF ADVOCACIA,1
UNIVERSIDADE ESTADUAL PAULISTA  &QUOT;JULIO DE MESQUITA FILHO&QUOT; - CAMPUS DRACENA,1
CENTRO UNIVERSITARIO ADVENTISTA DE SAO PAULO - EC,1
"INSITUTO FEDERAL DE EDUCACAO, CIENCIA E TECNOLOGIA DA BAHIA",1
CLINICA FHMENDES DE CIRURGIA PLASTICA,1
UNIDADE DE ESPECIALIDADES E SUPORTE VETERINARIO,1
CASA MELI LTDA,1
ASSOCIACAO NACIONAL DE POS GRADUACAO E PESQUISA EM EDUCACAO,1
INTERNATIONAL INSTITUTE OF PHYSICS,1
CENTRO UNIVERSITARIO DO SENAI PARANA,1
CEDERJ,1
MATTOS ENGELBERG ADVOGADOS,1
INSTITUTO FEDERAL DO PARANA - CAMPUS PARANAVAI,1
ESCOLA MUNICIPAL DE EDUCACAO INFANTIL E ENSINO FUNDAMENTAL ZUMBI DOS PALMAR,1
E.E.E.M.DR. ABEL FIGUEIREDO,1
OFICINA2MAIS ARQUITETURA E PLANEJAMENTO DA PAISAGEM LTDA.,1
FUNDACAO PIO XII - HOSPITAL DE AMOR,1
FIOCRUZ MINAS,1
INSTITUTO DA CRIANCA DO HOSPITAL DAS CLINICAS DA FACULDADE DE MEDICINA USP,1
HOSPITAL ESTADUAL BAURU,1
INSTITUTO SUPERIOR DE EDUCACAO NOSSA SENHORA DE SION,1
UNIVERSIDADE ESTADUAL DE MARINGA - CAMPUS UMUARAMA - PR.,1
TV INTEGRACAO,1
CLEUCIO E MARGARET NUNES ADVOCACIA E CONSULTORIA JURIDICA,1
SANTOS E BERGAMINI ASSOCIADOS,1
PREFEITURA MUNICIPAL DE SANTA HELENA - PB,1
EMGE - ESCOLA DE ENGENHARIA,1
FUNDACAO OSWALDO CRUZ (PR),1
COLEGIO AGRICOLA DE TERESINA / UNIVERSIDADE FEDERAL DO PIAUI,1
FACULDADE MAIS DE ITUIUTABA,1
ASSOCIACAO BRASILEIRA PARA O ESPORTE SUSTENTAVEL,1
TRIBUNAL REGIONAL DO TRABALHO DA 9. REGIAO - TRT 9,1
CLINICA DE PNEUMOLOGIA DR. MARCELO CHALHOUB,1
SECRETARIA DO ESTADO DE EDUCACAO DE MG,1
MG FISIOTERAPIA,1
CLINICA DE REABILITACAO ORAL E MAXILOFACIAL,1
ESPACO TERAPEUTICO GIRASSOL,1
PREVOR SPRL,1
PREFEITURA MUNICIPAL DE ARARIPE,1
"UNIVERSIDDAE FEDERAL DE UBERLANDIA, INSTITUTO DE BIOLOGIA",1
COLEGIO ESTADUAL PRINCESA IZABEL - EFM,1
ESCOLA SUPERIOR DE AGRICULTURA LUIZ DE QUEIROZ/UNIVERSIDADE DE SAO PAULO,1
ESCOLA ESTADUAL MARIA MADALENMA SANTANA DE LIMA,1
RC ODONTOLOGIA ESPECIALIZADA,1
CAMBONA CONSULTORIA E TECNOLOGIA AGROENDUSTRIAL,1
UNIVERSIDADE DO ESTADO DE SANTA CATARINA (UDESC),1
WPP GROUP,1
NORTH DAKOTA STATE UNIVERSITY,1
CANDICE BELCHIOR ORTODONTIA E ESTETICA,1
CLINICA PROF SERGIO RAMOS,1
PREFEITURA MUNICIPAL DE NOVO PROGRESSO,1
INSTITUTO FLORESTAL,1
FACULDADE DE ZOOTECNIA E ENGENHARIA DE ALIMENTOS DA UNIVERSIDADE DE SAO PAU,1
ICC FIOCRUZ,1
PREFEITURA MUNICIPAL DE NAZARE,1
UNIVERSIDADE DO ESTADO DE MINAS GERAIS - DIVINOPOLIS,1
INSTITUTO DE CRIMINALISTICA BAURU,1
E.E.F. LUIZ LIBERATO DE CARVALHO,1
ALLK - TECNOLOGIA DA INFORMACAO LTDA,1
UNIVERSIDADE TIRADENTES/FACIPE,1
HEALTH SECURITY PARTNERS,1
UNIVERSIDAD DEL CHUBUT,1
"UNIVERSIDADE ESTADUAL PAULISTA, CAMPUS DE JABOTICABAL",1
FACULDADES ESUCRI,1
PREFEITURA MUNICIPAL DE CASTELO,1
ZYTRAX CONSULOTIRA,1
TRIBUNAL REGIONAL DO TRABALHO 15 REGIAO,1
FACULDADE DE DIREITO DE RIBEIRAO PRETO UNIVERSIDADE DE SAO PAULO,1
ASSOCIACAO TEATRO OFICINA UZYNA UZONA,1
INSTITUTO E SE FOSSE VOCE?,1
SQUITTER METEOROLOGIA E HIDROLOGIA,1
ESCOLA DE EDUCACAO BASICA CORDILHEIRA ALTA,1
INSTITUTO DO CANCER DE SAO PAULO,1
E E AYR PICANCO BARBOSA DE ALMEIDA,1
UNIVERSIDADE FEDERAL  SAO JOAO DEL REI,1
CONSULTORIO ODONTOLOGICO UISLEN CADORE,1
INFACE DESIGN GRAFICO,1
ESTACIO BAHIA,1
FACULDADE DE TECNOLOGIA ALFA DE UMUARAMA,1
HUMANIS FISIOTERAPIA,1
SINDICATO DOS PROFESSORES DE SAO PAULO,1
INSTITUTO DE ODONTOLOGIA DO CEARA,1
CENTRO BRASIL DESIGN,1
SERVICO AUTONOMO DE SANEAMENTO DE PELOTAS,1
IFBA - CAMPUS SALVADOR,1
INSTITUTO PASTEUR DE MONTEVIDEO,1
ESCOLA MUNICIPAL AYRTON SENNA DA SILVA,1
IFSP - CAMPUS DE TUPA,1
CENTRO DE PESQUISAS RENE RACHOU (FIOCRUZ),1
VITA,1
LABORATORIO DE PROCESSAMENTO DE IMAGENS E GEOPROCESSAMENTO,1
NUCLEO DE ORTOPEDIA E TRAUMATOLOGIA ESPORTIVA,1
HOSPITAL REGIONAL TARCISIO DE VASCONCELOS MAIA,1
ESCOLA SUPERIOR DE ADMINISTRACAO MARKETING E COMUNICACAO DE UBERLANDIA,1
SECRETARIA DE EDUCACAO E CULTURA DO ESTADO DO RIO GRANDE DO NORTE,1
SECRETARIA DA EDUCACAO E DA CIENCIA E TECNOLOGIA DA PARAIBA,1
COLEGIO TECNICO DA ESCOLA DE EDUCACAO BASICA E PROFISSIONAL DA UFMG,1
CENTRO DE PESQUISA E GESTAO DE RECURSOS PESQUEIROS DO LITORAL NORDESTE,1
FACULDADE CNA,1
ENVIRONMENTAL POLICY LAB,1
COLEGIO SINODAL GUSTAVO ADOLFO,1
PREFEITURA MUNICIPAL VIGIA DE NAZARE,1
SUPERINTENDENCIA DE ESTUDOS ECONOMICOS E SOCIAIS,1
"RAGON INSTITUTE OF MGH, MIT, AND HARVARD",1
UNIVERSIDADE FDERAL RURAL DA AMAZONIA,1
NUCLEO TERRITORIAL DE EDUCACAO DO SISAL,1
FACULDADE DE  EDUCACAO DE PORTO VELHO,1
MANOEL CAETANO ADVOCACIA,1
CENTRO ECUMENICO DE SERVICOS A EVANGELIZACAO E EDUCACAO POPULAR,1
FUNDACAO NOAH,1
SUPERINTENDENCIA REGIONAL DE ENSINO DE UBERABA,1
SECRETARIA MUNICIPAL DE EDUCACAO DE  PALHOCA-SC,1
ESCOLA ESTADUAL CORONEL JOAQUIM RIBEIRO,1
CLINICA BIOPSIQUE,1
UBM - CENTRO UNIVERSITARIO DE BARRA MANSA,1
AGENCIA PAULISTA DE TECNOLOGIA DOS AGRONEGOCIOS/SAA/SP,1
UNIVERSITY OF THE INCARNATE WORD,1
EMPRESA BRASILEIRA DE PESQUISA AGROPECUARIA - EMBRAPA SEMI-ARIDO,1
SPECTRALGRID INOVACOES TECNOLOGICAS E SENSORIAMENTO REMOTO LTDA.,1
CENTRO DE REFERENCIA PARA IMUNOBIOLOGICOS ESPECIAIS,1
FUNDACAO GETULIO VARGAS - FGV-SP,1
LABORATORIO DE REPARO DE DNA,1
HOSPITAL UNIVERSITARIO ANA BEZERRA/EBSERH,1
HOSPITAL UNIVERSITARIO PROFESSOR EDGAR SANTOS/UFBA/EBSERH,1
COLEGIO TEN. REGO BARROS,1
CLINICA DR. JOAO DANIEL,1
EQUIPE EDUCACIONAL GH LTDA,1
AQUAGEN CHILE,1
INSTITUTO LUTERANO DE ENSINO SUPERIOR DE ITUMBIARA-GO,1
COLEGIO FRACTAL,1
"A FUNDACAO DE APOIO A ESCOLA TECNICA - FAETEC, VINCULADA A SECTI - SECRETAR",1
INSTITUTO DE CIENCIAS BIOMEDICAS II,1
HOSPITAL DE CLINICAS PR,1
UNIVERSIDADE DE RIO VERDE - CAMPUS APARECIDA DE GOIANIA,1
INSTITUTO BMF LONDRINA,1
CENTRO INTERNACIONAL UNINTER,1
FRATA AMBIENTAL LTDA,1
FACULDADE SANTA MARCELINA MURIAE -MG,1
CONSULTORIO ODONTOLOGICO DEISE CAREN SOMACAL,1
CENTRO DE PESQUISA AGROPECUARIA DOS CERRADOS,1
ESCOLA ESTADUAL PROFESSOR VALDOMIRO CANDIDO,1
"SINERCONSULT  - CONSULTORIA, TREINAMENTO E PARTICIPACOES",1
FACULDADE COSMOPOLITA,1
UNIVERSIDAD NACIONAL DE PILAR,1
RITTER & LINHARES ADVOCACIA,1
UNIVERSIDADE ESTATUAL PAULISTA JULIO DE MESQUITA FILHO,1
GSO - MEDICINA OCUPACIONAL,1
UNIVERDADE FEDERAL DO AGRESTE DE PERNAMBUCO,1
UNIVERSIDADE FEDERAL DE GOIAS - JATAI/GO,1
"INSTITUTO FEDERAL DE EDUCACAO, CIENCIA E TECNOLOGIA SUL-RIO-GRANDENSEI",1
UNIVERSITY OF LODZ,1
PAULUS EDITORA,1
PACAR MAQUINAS E EQUIPAMENTOS PNEUMATICOS LTDA.,1
FUNDACAO PROJETO PESCAR,1
SUPERINTENDENCIA DE RECURSOS HIDRICOS,1
INSTITUTO FEDERAL DE MATO GROSSO - CAMPUS CONFRESA,1
AMICCI ODONTOLOGIA ESPECIALIZADA,1
ESCOLA MUNICIPAL MARIA ODILA,1
FACULDADE DE MEDICINA DE RIBEIRAO PRETO- FMRP/USP,1
APSEN FARMACEUTICA,1
ELETRONUCLEAR S.A.,1
ESPACO MUSICAL IVAN BARASNEVICIUS,1
FACULDADES INTEGRADAS ESPIRITA,1
FACULDADE CATOLICA SANTA TERESINHA,1
PREFEITURA DE SAO GONCALO,1
UNIVERSIDADE DO EXTREMO SUL CATARINENSE/SC,1
PREFEITURA MUNICIPAL DE JOAO PINHEIRO,1
UNIVERSITY OF TEXAS SOUTHWESTERN MEDICAL CENTER,1
PREFEITURA MUNICIPAL DE RIO VERDE,1
UNIVERSIDADE DO GRANDE ABC,1
"WAMBIER, YAMASAKI, BEVERVANCO E LOBO ADVOCACIA E CONSULTORIA JURIDICA",1
FACULDADE DE TECNOLOGIA E CIENCIAS DA BAHIA,1
FACULDADE DE TECNOLOGIA DE CAMPINAS,1
2 OFICIO DE JUSTICA DE NITEROI/RJ,1
UNIVERSIDEDE FEDERAL DA PARAIBA,1
MARTINS E ROSSI EDUCACIONAL,1
UNIVERSITE BRETAGNE SUD,1
HOSPITAL ACCAMARGO,1
FERREIRA FREDES ADVOGADOS ASSOCIADOS,1
CENTRO OCEANOGRAFICO DE MURCIA,1
UNIVERSIDADE FEDERAL DE GOIAS/ JATAI,1
OSMAR TEIXEIRA ADVOGADOS ASSOCIADOS,1
INSTITUTO DE PESQUISA EM FAUNA NEOTROPICAL,1
INSTITUTE FOR QUANTUM COMPUTING - IQC,1
SERVICO NACIONAL DE APRENDIZAGEM COMERCIAL DO ESTADO DE SAO PAULO,1
CEEFEM: ANTONIO CARLOS BECMAM,1
ESCOLA MUNICIPAL AUREA BICALHO,1
SECRETARIA DE ESTADO SAUDE,1
FUNDACAO OSWALDO CRUZ - PI - BRASIL,1
EQUILIBRIO DO CORPO FISIOTERAPIA LTDA,1
UNIVERSIDADE CORPORATIVA DA POLICIA RODOVIARIA FEDERAL,1
CARLOS HENRIQUE CRUZ ADVOCACIA,1
ALVES E SIMI - CONSULTORIA E APERFEICOAMENTO PROFISSIONAL,1
IOP/GRAACC/UNIFESP,1
SIND. DAS ENTIDADES MANTENEDORAS DE INSTITUICOES DE ENSINO SUPERIOR DO DF,1
INSTITUTO FEDERAL DE CIENCIA E TECNOLOGIA DO ACRE,1
PREFEITURA MUNICIPAL DE PADRE MARCOS,1
CENTRO DE EDUCACAO PROFISSIONAL,1
POLICLINICA MILITAR DA PRAIA VERMELHA,1
MINISTERIO PUBLICO JUNTO AO TRIBUNAL DE CONTAS DO ESTADO DO RIO GRANDE DO S,1
"RABAY, PALITOT & CUNHA LIMA",1
EMPRESA DE PESQUISA AGROPECUARIA E EXTRENSAO RURAL DE SANTA CATARINA,1
INSTITUTO SENAI DE TECNOLOGIA EM MEIO AMBIENTE,1
THE UNIVERSITY OF MANCHESTER,1
CENTRO DE ACAO SOCIAL SAO FRANCISCO DE ASSIS,1
KHYBER MEDICAL UNIVERSITY,1
"INSTITUTO DE EDUCACAO, CIENCIA E TECNOLOGIA DO ACRE, XAPURI",1
INSTITUTO FRATELLI,1
ESCOLA COMUNITARIA DE CAMPINAS,1
INNOVEAGRO - PESQUISA E CONSULTORIA AGRONOMICA,1
SECRETARIA MUNICIPAL DE SAUDE DE MACAE / RJ,1
COMPLEXO HOSPITALAR UNIVERSITARIO PROFESSOR EDGARD SANTOS,1
SECRETARIA ESTADUAL DE EDUCACAO-MG,1
CENTRO DE CIENCIAS EM EDUCACAO E REABILITACAO FISICA,1
ETEC TENENTE AVIADOR GUSTAVO KLUG,1
CEPPA - CENTRO DE PESQUISA E PLANEJAMENTO AMBIENTAL,1
CENTRO DE TERAPIA OCULAR ESPECIALIZADO,1
SEBRAE - UNIDADE REGIONAL DE BOM JESUS - URBJ,1
ESCOLA SANTA MONICA,1
SECRETARIA MUNICIPAL DE EDUCACAO - PREFEITURA MUNICIPAL DE BELEM,1
PREFEITURA MUNICIPAL DE CONCORDIA,1
ESCOLA DE ENFERMAGEM ANNA NERY / UFRJ,1
ASSOCIACAO DOS PROCURADORES DO ESTADO/SE (APESE),1
FACULDADE DE ODONTOLOGIA DE BAURU DA UNIVERSIDADE DE SAO PAULO,1
L&M FLORESTAL,1
CULTIVE CONSULTORIA E ASSESSORIA AMBIENTAL,1
UNIVERSIDADE DO ESTADO DO RIO DE JANEIRO / FFP-SG,1
MVA ASSESSORIA FINANCEIRA,1
FUSAM HOSPITAL GETULIO VARGAS,1
ORBE LAB,1
FACULDADE SAO LEOPOLDO MANDIC CAMPINAS,1
COLEGIO SINODAL TRAMANDAI,1
CENTRO DE REFERENCIA E TREINAMENTO EM DST/AIDS - HOSPITAL DIA - PEDIATRIA,1
UNIVERSIDADE DE VILA VELHA,1
COORDENADORIA ESTADUAL DE DEFESA DOS ANIMAIS - CEDA,1
ZELO CONSULTORIA EM EDUCACAO E DESENVOLVIMENTO INFANTIL,1
ACADEMIA BRASILEIRA DA VISAO,1
CENTRO DE ENDOCRINOLOGIA E METABOLOGIA,1
INSTITUTO FEDERAL DO MARANHAO - CAMPUS BARREIRINHAS,1
AUGSBURG COLLEGE,1
CENTRO DE DESENVOLVIMENTO DE SISTEMAS,1
MASCHIO FIORAVANTI COMUNICACAO S/S LTDA.,1
ATIVO ALIMENTOS EXP. E IMP. EIRELI,1
POLICIA MILITAR DO ESTADO DO TOCANTINS,1
ESCRITORIO DE ADVOCACIA - ALINE OURIQUES,1
CLINICA INSTITUTO FATOR HUMANO,1
VASCULARV,1
GASTROMED LTDA.,1
ESCOLA DE ADMINISTRACAO - UFBA,1
REDE ILUMNO,1
BOCCACIO OLIVEIRA ADVOGADOS,1
EASTERN MICHIGAN UNIVERSITY,1
SOLUCAO ATIVA - ANALISE E ESTUDOS JUNGUIANOS,1
INSTITUTO DE SAUDE ESPECIALIZADO,1
UNIVERSIDADE ESTADUAL PAULISTA - UNESP/FAAC,1
INSTITUTO DE ENSINO CAMPO LIMPO PAULISTA S/C LTDA - SP,1
FACULDADE DE ODONTOLOGIA DA UNIVERSIDADE DE CUIABA - FOC - UNIC,1
"FACULDADE DE CIENCIAS HUMANAS, EXATAS E DA SAUDE DO PIAUI",1
DIREITO GV,1
"INSTITUTO FEDERAL DE EDUCACAO, CIENCIA E TECNOLOGIA DE MG - CAMPUS SABARA",1
CONSULTORIO PARTICULAR DE PSICOTERAPIA E PSICANALISE,1
UP CONSULTORIA JR.,1
FUNDACAO GAUCHA DO TRABALHO E ACAO SOCIAL,1
JOSLIN DIABETES CENTER - HARVARD MEDICAL SCHOOL,1
UNIVERSIDAD IBEROAMERICANA,1
FACULDADE DE CIENCIAS E LETRAS - UNESP - CAMPUS DE ASSIS,1
INSTITUTO FEDERAL DE PERNAMBUCO- CAMPUS CARUARU (PE),1
FACULDADE CIDADE TEOLOGICA PENTECOSTAL,1
ASSESSORIA E CONSULTORIA JURIDICA,1
GAMIL FOPPEL ADVOGADOS ASSOCIADOS,1
FUNDACAO SHUNJI NISHIMURA DE TECNOLOGIA,1
"UNIVERSIDADE DE CAXIAS DO SUL, INSTITUTO DE MEDICINA DO ESPORTE",1
MISSNER & MISSNER,1
FACULDADE CATOLICA DO AMAZONAS,1
CONSELHO REGIONAL DE ENFERMAGEM DO ESPIRITO SANTO,1
TUPINAMBA ADVOGADOS,1
INSTITUTO ONCOLOGICO 9 DE JULHO,1
"SECRETARIA DE EDUCACAO, CULTURA, ESPORTE E LAZER, DA PREFEITURA DE ALEGRETE",1
RIO MEDICINA OCULAR,1
PREFEITURA MUNICIPAL DE MARECHAL CANDIDO RONDON,1
COMPLEXO HOSPITALAR DE NITEROI,1
SECRETARIA DE SAUDE DO MUNICIPIO DE CABEDELO,1
CENTRO DE ENSINO UNIFICADO DE BRASILIA,1
UNIVERSIDADE PARANAENSE - UNIDADE UNIVERSITARIA DE FRANCISCO BELTRAO - PR,1
"FACULDADE DE ZOOTECNIA E ENGENHARIA DE ALIMENTOS, FZEA",1
INSTITUTO AGGEU MAGALHAES (FIOCRUZ),1
CAMARA MUNICIPAL DE CAXIAS DO SUL,1
ESCOLA MUNICIPAL GOLDA MEIR,1
REDE CENTRO OESTE DE RADIO E TELEVISAO - AFILIADA SBT,1
INSTITUTO VIVER,1
ARALDI&SONNTAG ADVOGADOS,1
PREFEITURA MUNICIPAL DE SAO JOAQUIM DE BICAS,1
PROMOTORIA DE JUSTICA DE COMBATE AOS CRIMES CONTRA CRIANCAS E ADOLESCENTES,1
CENTRO EDUCACIONAL-03,1
UNIDADE DE PRESERVACAO DO PATRIMONIO HISTORICO,1
CLINICA DR. RAPHAEL PRATALI,1
SOCIEDADE UNIFICADA AUGUSTO MOTTA,1
CAPUL - COOPERATIVA DOS PRODUTORES DE LEITE DE UNAI,1
DM AQUATIC CENTER,1
ASSESSORIA POPULAR MARIA FELIPA,1
UNIVERDSIDADE FEDERAL DA PARAIBA,1
FACULDADE INTEGRAL DIFERENCIAL-WYDEN,1
INSTITUTO FEDERAL DE CIENCIA E TECNOLOGIA DO CEARA,1
SECRETARIA ESTADUAL DE EDUCACAO DO ESTADO DE SAO PAULO,1
NUTRIPLUS ALIMENTACAO E TECNOLOGIA,1
PREFEITURA MUNICIPAL DE SANTA MARIA DO HERVAL,1
CENTRO DE ESTUDOS DE INSETOS SOCIAIS - UNESP CAMPUS RIO CLARO.,1
CETESB COMPANHIA AMBIENTAL DO ESTADO DE SAO PAULO,1
EDUCACAO INFANTIL COMECAR BEM,1
NOVA ESCOLA LACANIANA DE PSICANALISE,1
CENTRO FEDERAL DE EDUCACAO TECNOLOGICA DE BELO HORIZONTE,1
CENTRO DE DOENCAS RENAIS DO AMAZONAS LTDA,1
INSTITUTO BRASILEIRO DE GEOGRAFIA  E ESTATISTICA,1
ILUMINAR PRATICAS INTEGRATIVAS,1
ESCOLA TECNICA ESTADUAL MINISTRO FERNANDO LYRA,1
CONSULTORIO DR. RENAN BOSIO,1
TRIBUNAL DE JUSTICA DE ALAGOAS,1
FUND. UNIVERSIDADE FEDERAL DO VALE DO SAO FRANCISCO,1
FUNDACAO OSWALDO CRUZ / INSTITUTO RENE RACHOU,1
CLINICA GOLDMAN DE CIRURGIA PLASTICA,1
INSTITUTO DE ODONTOLOGIA DA PUC-RJ,1
FACULDADE DE MEDICINA DO ABC - FUNDACAO SANTO ANDRE,1
ESCOLA MUNICIPAL DE ENSINO FUNDAMENTAL BOA VISTA,1
UNESPAR - PARANAGUA,1
BRUNO FREIRE SOCIEDADE DE ADVOGADOS,1
UNIVERSIDADE  FEDERAL DE RONDONIA,1
CENTRO DE ESTUDOS DA ASSEMBLEIA DE DEUS NA PARAIBA,1
ENSINO SUPERIOR DE EDUCACAO FISICA,1
MAX PLANCK INSTITUTE OF GEOANTHROPOLOGY,1
UNIVERSIDAD ESCUELA DE ADMINISTRACION DE NEGOCIOS,1
CENTRO FEDERAL DE EDUCACAO TECNOLOGICA DO PIAUI,1
SERVICO SOCIAL DA CONSTRUCAO CIVIL DO ESTADO DE SAO PAULO,1
FACULDADE DE INHUMAS - FACMAIS,1
PREFEITURA MUNICIPAL DE MAIRIPORA,1
CONSULTORIO ODONTOLOGICO DR. EDUARDO SERA,1
UNIVERSIDADE FEDERAL DO RIO DE JANEIRO - MACAE,1
FACULDADE DE ODONTOLOGIA DE SAO JOSE DOS CAMPOS UNESP,1
UNIVERSIDADE EVANGELICA DE GOIAS -APOSENTADA,1
MORADIA,1
ETEC DE CIDADE TIRADENTES - CENTRO PAULA SOUZA,1
CENTRO DE PESQUISA EM HISTORIA NATURAL E ARQUEOLOGIA DO MARANHAO,1
HOSPITAL PEDIATRICO MARIA ALICE FERNANDES,1
GRANT THORNTON AUDITORIA E CONSULTORIA,1
UNIVERSIDADE MAX PLANCK,1
BURKE ADVOGADOS,1
KM OFTALMOLOGIA,1
COLEGIO DA POLICIA MILITAR - CPM ERALDO TINOCO,1
CURSINHO PRE-UNIVERSITARIO PSICO-USP,1
VIDA PRODUCOES,1
CENTRO UNIVERSITARIO AMPARENSE,1
MUSEU DE ZOOLOGIA UNIVERSIDADE DE SAO PAULO,1
GRADUAL - GRUPO DE INTERVENCAO COMPORTAMENTAL,1
FACULDADE DE ARQUITETURA UNIVERSIDADE PRESBITERIANA MACKENZIE,1
ESCOLA SUPERIOR DE EDUCACAO FISICA DE GOIAS,1
UNIVERSIDADE FEDERAL DO PIAUI- CAMPUS PARNAIBA,1
INSTITUTO FEDERAL DO CEARA - CAMPUS CRATO,1
INSTITUTO FEDERAL DO CEARA  - IFCE CAMPUS ARACATI,1
TECHNISCHE UNIVERSITEIT VANGUARD,1
CLINICARE,1
HOSPITAL DE CLINICAS DE CONQUISTA,1
HELICOPTEROS DO BRASIL S/A,1
COLEGIO AUTENTICO,1
CMEI PROFESSORA MARIA ESMERALDA AYRES DE OLIVEIRA,1
CENTRO DE PESQUISAS AGGEU MAGALHAES - FIOCRUZ PE,1
HUDSONALPHA INSTITUTE FOR BIOTECHNOLOGY,1
FUNDACAO PARA O DESENVOLVIMENTO DAS CIENCIAS,1
COORDEANDORIA DE VIGILANCIA DO ESTADO DE MATO GROSSO DO SUL,1
DEPARTAMENTO DE CIRURGIA UFRN,1
PETROLEO BRASILEIRO S. A.,1
VITALFORCE INSUMOS AGRICOLAS,1
UNEB - CAMPUS XXII,1
HOSPITAL UNIVERSITARIO DE DOURADOS,1
CENTRO UNIVERSITARIO UNIFTC FEIRA DE SANTANA,1
EDIFICIO NOVO MUNDO,1
MAX-WEBER-KOLLEG FUR KULTUR- UND SOZIALWISSENSCHAFTLICHE STUDIEN,1
CONSULTOR CERTIFICADO INDEPENDENTE CCI - 3I - STRATIMIDIA,1
COLEGIO ISRAELITA BRASILEIRO A. LIESSIN SCHOLEM ALEICHEM,1
FUNDACAO OSWALDO CRUZ (DF),1
SECRETARIA DE EDUCACAO/GOVERNO DE PERNAMBUCO,1
UNIVERSIDADE SAGRADO CORACAO,1
INSTITUTO OSWALDO CRUZ - FIOCRUZ,1
UROLIT,1
DEPARTAMENTO DE ENGENHARIA DE CONSTRUCAO CIVIL DA ESCOLA POLITECNICA DA USP,1
MENDES E NAGIB ADVOGADOS,1
CENTRO DE ESTUDOS EM GEOPOLITICA E RELACOES INTERNACIONAIS,1
PROCURADORIA GERAL DA JUSTICA DO ESTADO DO RIO GRANDE DO NORTE,1
BETTERNOSTIC,1
DEPARTAMENTO DE EDUCACAO DE GUANAMBI - CAMPUS XII - UNEB,1
INSTITUTO DE ORTOPEDIA E NEUROLOGIA SEGUTI,1
ESCOLA DE REFERENCIA EM ENSINO MEDIO BENIGNO PESSOA DE ARAUJO,1
FATEC COTIA,1
LINNEUNIVERSITETET - VAXJO,1
EMBRAPA/CENTRO NACIONAL DE PESQUISA DO ALGODAO - CNPA/PB,1
PREFEITURA MUNICIPAL DE ARAPONGAS,1
INIA,1
NUCLEO DE ESTUDOS DA VIOLENCIA DA UNIVERSIDADE DE SAO PAULO,1
FORUM DO CAMPO LACANIANO RIO DE JANEIRO,1
UNIVERSIDADE DE CALGARY,1
UNIVERSIDADE UNIRG,1
ROCHA & FLORIANI ADVOGADOS ASSOCIADOS,1
COLEGIO AGRICOLA DE ARAQUARI,1
PREFEITURA DA CIDADE DO RECIFE - SECRETARIA DE SAUDE,1
SMART AGRI SOLUCOES TECNOLOGICAS,1
CLUBE BAHIANO DE TENIS,1
COORDENACAO DE HISTORIA DA CIENCIA,1
RUDN UNIVERSITY,1
FUNDACAO PRO-MEMORIA DE SAO CARLOS,1
SECRETARIA DE ESTADO DE MATO GROSSO DO SUL,1
HOSPITAL UNIVERSITARIO DA UNIVERSIDADE FEDERAL DO MARANHAO/ UNIDADE MATERNO,1
"INSTITUTO FEDERAL DE EDUCACAO,CIENCIA E TECNOLOGIA DO CEARA, CAMPUS CANINDE",1
NUCLEO DE TECNOLOGIAS EDUCACIONAIS DE SC,1
INVISYS SISTEMAS DE VISAO COMPUTACIONAL,1
SENTIDOS MEDICAL CENTER,1
ASSOCIACAO NACIONAL DOS EXPORTADORES DE CEREAIS,1
COLEGIO DINAMICO DBA,1
UNIV. FED. SAO PAULO,1
"UNIVERSIDADE FEDERAL DE SAO PAULO, DEPARTAMENTO DE BIOCIENCIAS",1
UERGS,1
ESCOLA DE MATEMATICA APLICADA,1
COORDENADORIA DE CONTROLE DE DOENCAS DO ESTADO DE SAO PAULO,1
CENTOGENE GBMH,1
ASSEMBLEIA LEGISLATIVA DO ESTADO DO PARA,1
PREFEITURA MUNICIPAL DE CAMBORIU,1
UNIVERSDIDADE FEDERAL DA PARAIBA,1
HOSPITAL DO SERVIDOR PUBLICO MUNICIPAL  SP,1
PREFEITURA MUNICIPAL DE MAUA,1
ESTADO DO RIO GRANDE DO SUL - BRIGADA MILITAR,1
UNIVERSIDADE FEDERAL DO RIO DE JANEIRO-CAMPUS MACAE,1
VAN YUZUNCU YIL UNIVERSITY,1
UFL DESENVOLVIMENTO DE PROJETOS,1
INSTITUTO DE PESQUISA EM AIDS DO ESTADO DO RIO GRANDE DO SUL,1
CLINICA HARMONIE,1
UNIP CAMPUS ALPHAVILLE,1
CENTRO DE SAUDE ESCOLA &QUOT; ACHILLES LUCIANO DELLEVEDOVE&QUOT;,1
LABORATORIO DE INVESTIGACAO EM NUTRICAO E DOENCAS CRONICO - DEGENERATIVAS,1
"BAPTISTA LUZ, GIMENEZ E FREITAS ADVOGADOS",1
CENTRO UNIVERSITARIO ARNALDO JANSSEN,1
HOSPITAL MUNICIPAL DE GOVERNADOR VALADARES,1
IMMUNOX BIOTECNOLOGIA LTDA,1
INSTITUTO CARLOS CHAGAS/ FUNDACAO OSWALDO CRUZ - PR,1
SECRETARIA DE ESTADO DA EDUCACAO DO ESTADO DE SERGIPE,1
SCANDELAI CONSULTORIA AMBIENTAL & SEGURANCA DO TRABALHO,1
FUNDACAO DO ABC - HOSPITAL ESTADUAL MARIO COVAS DE SANTO ANDRE,1
MUSEU OCEANOGRAFICO PROF ELIEZER DE C RIOS DE RIO GRANDE,1
CENTRO CRISTAO DE ESTUDOS JUDAICOS,1
HOSPITAL SANTA CASA DE MISERICORDIA DE CURITIBA,1
TRIBUNAL DE CONTAS DO ESTADO DO MARANHAO,1
"UNIVERSIDADE FEDERAL DA GRANDE DOURADOS, FACULDADE DE CIENCIAS AGRARIA.",1
PREFEITURA MUNICIPAL DE ARAPOTI,1
LIMAGRAIN BRASIL S.A.,1
ENERQ - CENTRO DE ESTUDOS EM REGULACAO E QUALIDADE DE ENERGIA,1
"INSTITUTO DE CIENCIAS, COMPORTAMENTO E TECNOLOGIAS DE ENSINO",1
INSTITUTO DA CRIANCA DO HOSPITAL CLINICAS DA FFM DA USP,1
INSTITUTO DE CIENCIAS DA SAUDE - UFBA,1
OIAFIA SOLUCOES SUSTENTAVEIS LTDA,1
INSTITUTO FEDERAL DE CIENCIA E TECNOLOGIA DO SUL DE MINAS GERAIS,1
BIOTEC - BIOTECNOLOGIA EM REPRODUCAO ANIMAL,1
CENTRO DE ESTUDOS SUPERIORES  DE BACABAL,1
AGENCIA DE FOMENTO DO ESTADO DE SANTA CATARINA S.A,1
HOSPITAL DAS CLINICAS DA FACULDADE DE MEDICINA DE RIBEIRAO PRETO - USP/SP,1
ORDEM DOS ADVOGADOS DO BRASIL - SAO PAULO,1
CENTRO UNIVERSITARIO AUGUSTO MOTA,1
PREFEITURA MUNICIPAL DE SAO SEBASTIAO DA BOA VISTA,1
RUD VARELA -  ESTETICA AVANCADA,1
CENTRO UNIVERSITARIO SALESIANO DE SAO PAULO U.E. LORENA,1
UNIVERSIDADE ESTADUAL DO CENTRO OESTE GUARAPUAVA,1
IMB CURSOS JURIDICOS,1
NUCLEO DE AUTOMACAO E CONTROLE,1
"FERNANDES, FIGUEIREDO, FRANCOSO E PETROS ADVOGADOS",1
FUNDACAO UNIVERSIDADE FEDERAL DE SAO JOAO DEL-REI,1
KLINIKUM DER UNIVERSITAT MUNCHEN,1
UNESP - FACULDADE DE CIENCIAS HUMANAS E SOCIAIS - CAMPUS FRANCA,1
MARKUS SAMUEL LEITE NORAT - ESCRITORIO,1
S.O. ORTOPEDIA E TRAUMATOLOGIA,1
CENTRO CULTURAL CONFORTI,1
"INSTITUTO FEDERAL DE EDUCACAO, CIENCIA E TECNOLOGIA - CAMPUS FORTALEZA",1
INSTITUTO FEDERAL DO PARA / CAMPUS BELEM,1
PREFEITURA MUNICIPAL DE MALHADA DE PEDRAS,1
PREFEITURA MUNICIPAL DE TUPANATINGA,1
"TOZZINI, FREIRE, TEIXEIRA E SILVA ADVOGADOS",1
NORTE PLANEJAMENTO ARQUITETONICO E TERRITORIAL LTDA.,1
PLATEINNOVE BIOTECHNOLOGY,1
INSTITUTO FEDERAL DO MARANHAO - CAMPUS TIMON,1
INSTITUTO DO CORACAO DO HOSPITAL DAS CLINICAS - UNIVERSIDADE DE SAO PAULO,1
UNITED ARAB EMIRATES UNIVERSITY,1
CENTRO DE EDUCACAO A DISTANCIA DO ESTADO DE RIO DE JANEIRO,1
CLINICA DO SONO & DOR OROFACIAL,1
PREMEN NORTE,1
INSTITUTO FEDERAL DA BAHIA - CAMPUS EUCLIDES DA CUNHA,1
DEPARTAMENTO ESTADUAL DE TRANSITO DE MATO GROSSO DO SUL,1
UNIVERSITE DE HAUTE-ALSACE,1
"FIPECAFI - FUNDACAO INSTITUTO PESQUISAS CONTABEIS, ATUARIAIS E FINANCEIRAS",1
