NOME-INSTITUICAO-EMPRESA,QUANTIDADE
BARROS ADVOGADOS ASSOCIADOS,1
FACULDADE SUMARE,1
CLINICA FRANCO,1
CENTRO UNIVERSITARIO DE EXCELENCIA,1
CENTAI INSTITUTE S.P.A.,1
TECH2THINK E TECH4THINK,1
UNIVERSIDADE DE SAO PAULO - USP,1
INNOVA ODONTOLOGIA ESPECIALIZADA,1
ESCOLA IRMA ELIZABETH,1
SECRETARIA DE ESTADO DE AGRICULTURA,1
CENTRO DE REFERENCIA EM SAUDE DO TRABALHADOR DE PIRACICABA,1
CENTRO DE ASSISTENCIA EM REPRODUCAO HUMANA,1
TELCOM TELEINFORMATICA LTDA,1
EDG TECNOLOGIA DA INFORMACAO,1
ZOCKUN & FLEURY ADVOGADOS,1
ESCOLA DE ENFERMAGEM DA UNIVERSIDADE DE SAO PAULO CAMPUS RIBEIRAO PRETO,1
UNIP - UNIVERSIDADE PAULISTA,1
FUNDACAO DE MEDICINA TROPICAL DO AMAZONAS,1
UNIVERSIDADE FEDERAL RURAL DO SEMIARIDO,1
NCC GROUP,1
SEMINARIO CONCORDIA,1
FACULDADE SAO BENTO DO RIO DE JANEIRO,1
PREFEITURA MUNICIPAL DE BAIA DA TRAICAO,1
CENTRO DE TECNOLOGIA EM VACINAS,1
CENTRO MEDICO GLICERIO,1
GRUPO HOSPITALAR CONCEICAO SA,1
EDUARDO MICHARKI VAVAS SOCIEDADE DE ADVOGADOS,1
NATIONAL AUTONOMOUS UNIVERSITY OF MEXICO,1
FACULDADE DE ENGENHARIA AGRICOLA - UNICAMP,1
E.E.E.M.VENINA PALMA,1
EEEP RITA MATOS LUNA,1
KLEINE NEVES ADVOGADOS ASSOCIADOS,1
SECRETARIA DE ESTADO DA SEGURANCA PUBLICA E DA PAZ SOCIAL,1
ESCOLA DE MUSICA DA UFRN,1
4S ADVOGADOS,1
HOSPITAL REGIONAL ADAMASTOR TEIXEIRA DE OLIVEIRA,1
ASSOCIACAO DE PESQUISA E PRESERVACAO DE ECOSSISTEMA AQUATICO,1
INSTITUTO DE DERMATOLOGIA MEDICINA E CIRURGIA ESTETICA,1
UFG CAMPUS GOIAS,1
ARQUIVO PUBLICO ESTADUAL - PE,1
TNO INOVATION FOR LIFE,1
FACULDADE DE ODONTOLOGIA DE ARARAQUARA-UNESP,1
FUNDACAO PRESIDENTE ANTONIO CARLOS,1
FACULDADE DE CIENCIAS MEDICAS/UNIVERSIDADE DO ESTADO DO RIO DE JANEIRO,1
FACEC/UMFG EDUCACIONAL,1
INSTITUTO CULTURAL VIA MAGIA,1
"INSTITUTO FEDERAL DE EDUCACAO, CIENCIA E TECNOLOGIA DO CEARA - QUIXADA",1
AGBITECH CONTROLES BIOLOGICOS LTDA,1
"UNIVERSIDADE ESTADUAL DE CAMPINAS. UNICAMP, BRASIL",1
PREFEITURA MUNICIPAL DE ARMACAO DE BUZIOS,1
INSTITUTO DE FISICA USP,1
JACOB & GONCALVES ADVOGADOS,1
INSTITUTO PENIDO BURNIER,1
FACULDADE INTEGRADO,1
SM ODONTOLOGIA,1
EMEF PROF. DIRCE BOEMER GUEDES DE AZEVEDO,1
"FACULDADE DE MEDICINA DA UNIVERSIDADE DE SAO PAULO, FMUSP, BRASIL.",1
IFMT - CAMPUS GUARANTA DO NORTE,1
"INSTITUTO FEDRAL DE EDUCACAO, CIENCIA E TECNOLOGIA DE PERNAMBUCO - CAMPUS P",1
"INSTITUTO DE BIOCIENCIAS, UNIVERSIDADE DE SAO PAULO",1
"INTITUTO FEDERAL DE EDUCACAO, CIENCIA E TECNOLOGIA DE SANTA CATARINA",1
"JURISMESTRE - AMBIENTE PARA UM APOIO ACADEMICO, CIENTIFICO E METODOLOGICO",1
FUNDACAO CENTRO UNIVERSITARIO UNIRG,1
COMPLEXO HOSPITAL DE CLINICAS UFPR,1
SIMULA UIB,1
INSTITUTO MEDICO CORA CORALINA,1
LEMOS VILELA ADVOCACIA,1
UNIVERSIDADE DE SAO PAULO - INSTITUTO DE CIENCIAS BIOMEDICAS,1
ASSOCIACAO TERESINENSE DE ENSINO S/C LTDA,1
HOSPITAL REGIONAL DETAGUATINGA,1
INSTITUTO FEDERAL DE SANTA CATARINA - CAMPUS LAGES,1
SECRETARIA M. DE EDUCACAO DE UBERABA,1
CLINICA DE MOLESTIAS DO APARELHO DIGESTIVO E VASCULAR,1
UNIMEO,1
OPHTHALMOTRAUMA LTDA.,1
SILVEIRO ADVOGADOS,1
NASA JET PROPULSION LABORATORY,1
UNISALESIANO AUXILIUM - ARACATUBA,1
EEMTI GOVERNADOR ADAUTO BEZERRA,1
UNIVERSIDADE DE ADMINISTRACAO E NEGOCIOS,1
FACULTY OF LOGISTICS,1
"DEPARTAMENTO DE LINGUA PORTUGUESA, LITERATURA PORTUGUESA FILOLOGIA",1
ESPACO LAVORATO,1
NITSCHKE GRABOSKI AGUSTINHO ADVOGADOS,1
"INSTITUTO CAPIXABA DE ENSINO, PESQUISA E INOVACAO EM SAUDE",1
TRIBUNAL DE JUSTICA DO ESTADO DO RIO GRANDE DO SUL (RS),1
ELIANE - REVESTIMENTOS CERAMICOS,1
SNAK CENTRO DE PESQUISA E ANALISES AGRONOMICAS E VETERINARIAS,1
MUSEU DE PALEONTOLOGIA &QUOT;PROF. ANTONIO CELSO DE ARRUDA CAMPOS&QUOT;,1
ANTUNES DA CUNHA ASSESSORIA JURIDICA,1
MINISTERIO DA SAUDE / AM,1
CENTRO UNIVERSITARIO TOLEDO ARACATUBA,1
ASSOCIACAO VERANENSE DE ASSISTENCIA EM SAUDE,1
TRIBUNAL REGIONAL DO TRABALHO DA 24A REGIAO,1
EPIDEMIOLOGIA E SERVICOS DE SAUDE,1
ESCOLA MUNICIPAL ROBERT FRANCIS KENNEDY,1
ROSKILDE UNIVERSITY,1
ESCOLA NACIONAL DE SAUDE PUBLICA / FIOCRUZ,1
DEPARTAMENTO DE ANTROPOLOGIA,1
DIVISION 1.1 INORGANIC TRACE ANALYSIS,1
CLINICA PROF ABRAO RAPOPORT,1
RENOVE AGROPESQUISA,1
UNIVERSIDADE FEDERAL DE UBERLANDIA - CAMPUS PATOS DE MINAS,1
CLINICA CORPO E ALMA,1
ESCOLA ESTADUAL IRMAN RIBEIRO DE ALMEIDA SILVA,1
CENTRO UNIVERSITARIO CATOLICO SALESIANO AUXILIUM - ARACATUBA,1
PREFEITURA MUNICIPAL DE ITABUNA - SECRETARIA M. DE EDUCACAO,1
DEPARTAMENTO DE ENGENHARIA E ARQUITETURA,1
FACULDADE DE CIENCIAS E LETRAS - FCL - UNESP,1
INSTITUTO LUTERANO DE ENSINO SUPERIOR UNIVERSIDADE LUTERANA DO BRASIL ITUMB,1
FACULDADE ESTACIO RS,1
ESCOLA ESTADUAL CARLOS GOES,1
TREVISOL ADVOCACIA,1
M & M SERVICOS DE FONOAUDIOLOGIA E ARTE LTDA,1
NANOTERRA,1
FACULDADE RAIZES,1
TRIBUNAL DE CONTAS DOS MUNICIPIOS DO ESTADO DO PARA,1
FUNDACAO CENTRO DE HEMATOLOGIA E HEMOTERAPIA,1
"VACCINE RESEARCH CENTER, NIAID/NIH",1
SERVICO DE ANESTESIA DE MARILIA,1
"WOIDA, FORBRIG, MAGNAGO & ADVOGADOS ASSOCIADOS",1
ASSEMBLEIA LEGISLATIVA DO ESTADO DO RIO GRANDE DO SUL,1
"FACULDADE DE FILOSOFIA, CIENCIAS E LETRAS DO ALTO SAO FRANCISCO",1
"FONGARO, INFANTINI E KELLER SOCIEDADE DE ADVOGADOS",1
PEDU EDUCACAO E TECNOLOGIA LTDA,1
VIEIRA CENEVIVA ADVOGADOS ASSOCIADOS,1
UNIVERSIDADE CATOLICA DO URUGUAI,1
MOREIRA DO PATROCINIO & AVELINO LANA ADVOGADOS,1
UNIVERSIDAD DE LAS AMERICAS PUEBLA,1
FACULDADE DE ODONTOLOGIA DA UNIVERSIDADE FEDERAL DE UBERLANDIA,1
APEX SCIENCE,1
SECRETARIA DE DEFESA SOCIAL DE PE,1
FACULDADE DE MEDICINA - UNIVERSIDADE FEDERAL DE MINAS GERAIS,1
COMPANHIA HIDRO ELETRICA DE SAO FRANCISCO,1
SALUTE,1
UNIVERSIDADE ESTADUAL DO OESTE DO PARANA - CAMPUS DE FRANCISCO BELTRAO,1
COLEGIO ESTADUAL FRANCISCO ASSUMPCAO,1
CONSELHO REGIONAL DE PSICOLOGIA DA 2 REGIAO,1
ANIS RASSI HOSPITAL,1
INSTITUTO BRUGNERA E ZANIN,1
BEDINI LAW FIRM,1
INSTITUTO DE FISICA UFRJ,1
"GEROVIDA - ARTE, EDUCACAO E VIDA PLENA",1
EMITER TECHNOLOGIES,1
LENUM AMBIENTAL PAPEL E DESIGN LTDA,1
FACULDADE DE TECNOLOGIA DE MAUA,1
GENETICENTER CENTRO DE GENETICA,1
AES SUL DISTRIBUIDORA GAUCHA DE ENERGIA - MATRIZ,1
CHALMERS UNIVERSITY OF TECHNOLOGY,1
COLEGIO BRASILEIRO DE ALTOS ESTUDOS,1
MUNGUBA SOLUCOES AMBIENTAIS EIRELI/EPP,1
CONSULTORIO ROSA RAHMI ENDO-CARDIO,1
LABORATORIO CENTRAL DO DISTRITO FEDERAL,1
UNIVERSIDADE DA INTEGRAA?A?O INTERNACIONAL DA LUSOFONIA AFRO-BRASILEIRA,1
UNIVERSIDADE ESTACIO/FAAC/EUROPAN,1
UNIVERSITETET I BERGEN,1
SECRETARIA MUNICIPAL DE EDUCACAO DE CARAGUATATUBA,1
POLICLINICA DE ESPECIALIDADE SILVIO PICANCO,1
FACULDADE MERIDIIONAL,1
TAINA MONTE ESTETICA AVANCADA,1
ESCOLA DE POLITICAS PUBLICAS E GOVERNO FGV EPPG (BRASILIA),1
GEOMAXO LTD,1
FUNDACAO CENTRO BRASILEIRO DE PROTECAO PESQUISA DAS TARTARUGAS MARINHAS,1
COOPERATIVA CENTRAL GAUCHA LTDA TECNOLOGIA,1
PREFEIRTURA MUNICIPAL DE MARITUBA,1
REGIS & REGIS ADVOCACIA,1
CENTRO DE EDUCACAO INTEGRAL RESSACA - CONTAGEM,1
UNIVERSIDAD NACIONAL DE UCAYALI,1
HOSPITAL DAS CLINICAS. FACULDADE DE MEDICINA-UNIVERSIDADE FEDERAL DE GOIAS,1
PREFEITURA MUNICIPAL DE BOM CONSELHO,1
GPEAS/UFMG,1
MINISTERIO PUBLICO DO MARANHAO,1
ESCOLA &QUOT;PROFESSOR CID CHIARELLI&QUOT; DA FUNDACAO EDUCACIONAL GUACUANA,1
PROCURADORIA GERAL DO ESTADO DO AMAZONAS,1
REAL SOCIEDADE PORTUGUESA DE BENEFICENCIA,1
MELLO ADVOGADOS ASSOCIADOS,1
EE PADRE ANCHIETA,1
UNIERSIDADE FEDERAL DE VICOSA,1
BIONEXUS TECNOLOGIA LTDA ME,1
SETE - CENTRO DE ESPECIALIDADES MEDICAS,1
UROCENTRO,1
IFPR - CAMPUS UMUARAMA,1
FACULDADE ATLANTICO,1
VEGA BRASIL DESIGN S/C LTDA,1
ASSOCIACAO BRASILEIRA DE PROFISSIONAIS DE ENSAIOS EM VOO,1
UNIVERSIDADE FEDERAL DO ESPIRITO SANTOS,1
DEPARTAMENTO DE EDUCACAO,1
CONSULTORIO PARTICULAR PSICOPEDAGOGIA E PSICOMOTRICIDADE,1
CLINICA EQUILIBRIO,1
ESCOLA ESTADUAL NOVO CEU,1
CENTRO ESTADUAL DE EDUCACAO PROFISSIONAL EM TURISMO DO LESTE BAIANO,1
ESCOLA ESTADUAL DEPUTADO DJALMA ARANHA MARINHO,1
INSTITUTO DE ENERGIA E AMBIENTE (USP),1
FACULDADES FAVENORTE,1
EEM ELIEZER DE FREITAS GUIMARAES,1
SERVICO A PASTORAL DA COMUNIACAO,1
ASSOCIACAO DOS EMPREGADOS NO COMERCIO DO RIO DE JANEIRO,1
ANDERSON CANTELI TREINAMENTO & CONSULTORIA,1
QAIR,1
FACULDADE DO CENTRO LESTE,1
INSTITUTO CENTRO DE VIDA,1
UNIVERSIDADE DE PERNAMBUCO MATA NORTE,1
UNIVERSIDADE ESTADUAL PAULISTA &QUOT;JALIO DE MESQUITA FILHO&QUOT;,1
COLEGIO ESTADUAL INACIO PINHEIRO PAES LEME,1
MAURO MENEZES & ADVOGADOS,1
UNIVERSIDAD NACIONAL DE COLOMBIA - PALMIRA,1
ADORE DENTAL STUDIO,1
INSTITUTE FOR SYSTEMS BIOLOGY,1
LAVAREDA REABILITACAO ORAL,1
INSTITUTO GONCALO MONIZ - FIOCRUZ,1
PREFEITURA MUNICIPAL DE LENCOIS PAULISTA,1
"INSTITUTO DE EDUCACAO, CIENCIA E TECNOLOGIA DO RIO GRANDE DO NORTE",1
CENTRO DE ESTUDOS DEMOGRAFICOS,1
NEW WAVE TECH,1
PREFEITURA MUNICIPAL DE VITORIA DA CONQUISTA - SECRETARIA DE COMUNICACAO,1
PREFEITURA MUNICIPAL DE NARANDIBA,1
INSTITUTO FEREDERAL DO CEARA CAMPUS CRATO,1
"MUSEU NACIONAL - UFRJ, MNRJ, BRASIL",1
DEPARTAMENTO DE ANATOMIA,1
FUNDACAO UNIVESIDADE FEDERAL DE RONDONIA,1
GENEPLUS CONSULTORIA AGROPECUARIA,1
KENNTECH TECNOLOGIA ELETRONICA LTDA,1
L2 PSICOLOGIA E INCLUSAO,1
SECRETARIA MUNICIPAL DE NORTELANDIA,1
RECEPTA BIOPHARMA S.A.,1
EEEFM PRESIDENTE GETULIO VARGAS,1
FACULDADE DE FORMACAO DE PROFESSORES DA MATA SUL,1
INSTITUTO SUPERIOR DE EDUCACAO AGATA,1
MUNHOZ E SOUZA SOCIEDADE DE ADVOGADOS,1
ASSEMBLEIA LEGISLATIVA DO ESTADO SANTA CATARINA,1
INTERNATIONAL UNION FOR CONSERVATION OF NATURE,1
INSTITUTO FEDERAL DO SUDESTE DE MG,1
INSTITUTO BRASILEIRO DE DIREITO TRIBUTARIO,1
UINIVERSIDADE FEDERAL DE PERNAMBUCO,1
SECRETARIA DE ESTADO DE AGRICULTURA E PECUARIA,1
BS DIAGNOSTICA,1
SERVICO DE ANIMACAO BIBLICA/PAULINAS,1
UFPR SETOR LITORAL,1
INSTITUTO BIOTROPICOS,1
ESCOLA ESTADUAL NOSSA SENHORA DA IMACULADA CONCEICAO,1
FURB - UNIVERSIDADE REGIONAL DE BLUMENAU,1
ORTOREUMA,1
INSTITUTO FEDERAL DO CEARA - ARACATI,1
GUARDA MIRIM,1
FACULDADE MEDICINA ABC,1
CONSULTORIO DE PSICOLOGIA TECIMENTOS,1
HOSPITAL METROPOLITANO DOUTOR CELIO DE CASTRO,1
FUNDACAO DO ENSINO DA ENGENHARIA EM SANTA CATARINA,1
IBMEC S/A,1
INSTITUTO DE OLHOS CHARLES COSTA,1
INSTITUTE OF CHEMISTRY - UNESP,1
INSTITUTO DE ARQUITETURA E URBANISMO DA UNIVERSIDADE DE SAO PAULO,1
SECRETARIA DE ESTADO DA FAZENDA DO PARANA,1
BIOXYZ BIOTECNOLOGIA MICROBIANA E BIOPROCESSOS INDUSTRIAIS LTDA,1
COMPANHIA MUNICIPAL DE SANEAMENTO,1
TRAUCZYNSKI MUFFONE ADVOGADOS,1
HOSPITAL EMILIO RIBAS,1
"INSTITUTO DE GEOGRAFIA E ORDENAMENTO DO TERRITORIO, UNIVERSIDADE DE LISBOA",1
FACULDADE DE FARMACIA - UNIVERSIDADE FEDERAL FLUMINENSE,1
FUNDACAO HELENA ANTIPOFF,1
PREFEITURA MUNICIPAL DE NOVA PETROPOLIS,1
VERUM DIAGNOSTICO VETERINARIO,1
UNIVERSIDAD LE CORDON BLUE,1
PARIS-SACLAY INSTITUTE OF NEUROSCIENCES,1
HOSPITAL MACRORREGIONAL DR RUTH NOLETO,1
INSTITUTO SENAI DE INOVACAO EM SIST. DE MANUFATURA E PROC. A LASER,1
INSTITUO THOPPI,1
FACULDADE SENAI DE TECNOLOGIA AMBIENTAL,1
"INSTITUTO MULTIDISCIPLINAR EM SAUDE, CAMPUS ANISIO TEIXEIRA",1
CENTRO DE ENERGIA NUCLEAR NA AGRICULTURA / USP,1
CULTURA INGLESA - SAO PAULO,1
SOCIEDADE EDUCACIONAL RIOGRANDENSE,1
CARVALHO E PELORCA SERVICOS MEDICOS,1
UNIVERSIDADE ESTADUAL DA PARAIBA - CAMPUS VIII,1
FORCA AEREA BRASILEIRA DE LAGOA SANTA/MG,1
INSTITUTO DE INOVACAO SOCIAL E DIVERSIDADE CULTURAL,1
E.E.,1
ALYSON LEAL ADVOCACIA,1
EE. PROFESSORA MARIA AMELIA GUIMARAES,1
SECRETARIA MUNICIPAL DE EDUCACAO DE SANTA TERESA,1
ASSOCIACAO PARQUE CIENTIFICO E TECNOLOGICO DO SUL DA BAHIA,1
"INSTITUICAO FEDERAL DE EDUCACAO, CIENCIAS E TECNOLOGIA DO CEARA",1
CONSULTORIO GISELE CHICONE CUIDADOS COM PELE LTDA,1
UNIVERSIDADE FEDERAL DO ACRE CAMPUS FLORESTA,1
NUTRIEN SOLUCOES AGRICOLAS,1
(UNICENTRO) UNIVERSIDADE ESTADUAL DO CENTRO-OESTE - PR,1
PROGRAMA DE APOIO AO DESENVOLVIMENTO INSTITUCIONAL DO SUS (PROADI-SUS),1
PREFEITURA MUNICIPAL DE UBAIRA,1
"MINISTERIO DESENVOLVIMENTO E ASSISTENCIA SOCIAL, FAMILIA E COMBATE A FOME",1
HUCK OTRANTO CAMARGO ADVOGADOS,1
UNIFECAF,1
CONSULTORIO DE PEDIATRIA,1
SEMED,1
"AGENCIA AMAZONENSE DE DESENVOLVIMENTO ECONOMICO, SOCIAL E AMBIENTAL",1
UNIVERSIDADE ESTADUAL PAULISTA /CAMPUS ARARAQUARA,1
ONCOLOGIA CLINICA FLORIANOPOLIS,1
FUNDACAO MAMIFEROS AQUATICOS - SERGIPE,1
FACULDADE MULTIVIX VITORIA,1
"UNESP - IBILCE (INSTITUTO DE BIOCIENCIAS, LETRAS E CIENCIAS EXATAS)",1
FACULDADE VIDAL DE LIMOEIRO DO NORTE,1
HANZE UNIVERSITY OF APPLIED SCIENCES,1
ESPACO ODONTO MEDICO CAMPO GRANDE,1
ETEC CENTRO PAULA SOUZA - ITUVERAVA,1
SECRETARIA DE SAUDE PUBLICA DO ESTADO DO PARA,1
ESCOLA DE EDUCACAO PROFISSIONAL SENAI,1
HOSPITAL E MATERNIDADE ANGELINA CARON,1
BENIN IMOVEIS LTDA.,1
HOSPITAL DAS CLINICAS/UNIVERSIDADE FEDERAL DE GOIAS,1
"PIGAO, FERRAO E FIORAVANTE ADVOGADOS ASSOCIADOS",1
PREFEITURA MUNICIPAL DE CAXIAS,1
JT INTERNATIONAL GERMANY GMBH,1
UNIVERSITY OF TEXAS AT SAN ANTONIO,1
E.E. MARAI ALICE CRISIUMA MESQUITA,1
UNIVERSIDADE FEDERAL DA PRAIBA,1
HOSPITAL DAS CLINICAS/EBSERH/UFMG,1
COORDENADORIA REGIONAL DE DESENVOLVIMENTO DE EDUCACAO 17,1
"INSTITUTO FEDERAL DE EDUCACAO, CIENCIA E TECNOLOGIA (CE)",1
CONSERVACAO INTERNACIONAL BRASIL,1
IFAL- CAMPUS PIRANHAS,1
ESCOLA DE COMUNICACAO E ARTES  /  ECA - USP,1
CENTRO DE PESQUISA AGLOFLORESTAL DE RORAIMA,1
TRE- TRIBUNAL REGIONAL ELEITORAL DO CEARA,1
COLAB GENETICS,1
DERMAPET - JF,1
SECRETARIA DE COMUNICACAO DO ESTADO DO PARA,1
CONTE COM AS 3,1
MYOGENETICA - CLINICA DE DOENCAS NEUROMUSCULARES,1
SERVENTIA EXTRAJUDICIAL DO 2 OFICIO DE ESTREITO,1
UFRB,1
PROGRAMA DE POS-GRADUACAO EM ANTROPOLOGIA SOCIAL DO MUSEU NACIONAL UFRJ,1
SECRETARIA DO MEIO AMBIENTE E INFRAESTRUTURA DO RS,1
INTELI - SERVICO DE INTELIGENCIA,1
UNIVERSITY OF MINESSOTA,1
UNIVERSITY MOHAMMED VI POLYTECHNIC,1
SOUZA CRUZ LTDA,1
2 VARA DA FAZENDA PUBLICA DA COMARCA DE NATAL,1
INSTITUTO DE CIENCIA E TECNOLOGIA - UNESP,1
CENTRO DE ENSINO A DISTANCIA DA UNIVERSIDADE DE BRASILIA,1
ESCOLA ESTADUAL GUIMARAES ROSA,1
HOSPITAL UNIVERSITARIO PEDRO ERNESTO/UERJ,1
FILIAL - IFAC CAMPUS RIO BRANCO,1
PREFEITURA MUNICIPAL DE MOGI DAS CRUZES,1
LABORATORIO CLINICO DE PIRIPIRI,1
TRINUAL DE CONTAS DOS MUNICIPIOS DE GOIAS,1
FUNDACAO DE ENSINO DE CONTAGEM - UNIDADE CENTEC,1
INSTITUTO DE PSIQUIATRIA DO HOSPITAL DAS CLINICAS DA FMUSP,1
HOSPITAL-ESCOLA DA UNIVERSIDADE FERNANDO PESSOA,1
GROUPE DE RECHERCHE ET D'ECHANGE TECHNOLOGIQUE,1
CENTRO DE PESQUISAS AGGEU MAGALHAES FUNDACAO OSWALDO CRUZ,1
POLICIA CIVIL DO ESTADO DO ESPIRITO SANTO,1
FACULDADE DE TECNOLOGIA DE SAO PAULO - FATEC,1
LABORATORIO DE PESQUISA MULTIMEIOS,1
"CENTRO DE PESQUISAS EPIDEMIOLOGICAS AMILCAR GIGANTE, UFPEL",1
FADESC / UNIASSELVI SC,1
SERVICO DE ANESTESIOLOGIA CLINICA DO MARANHAO,1
ROGERIO COSTA - AUTONOMO,1
COOPERATIVA DE TRABALHO DOS MEDICOS DO HOSPITAL DAS CLINICAS - UFMG,1
EXITUS ACADEMICO,1
ESCOLA MULTICAMPI DE CIENCIAS MEDICAS DO RN,1
HOSPITAL DA POLICIA MILITAR DE PE,1
GRUPO ESCOLAR JOAQUIM DO REGO CAVALCANTI,1
CAMP SEMENTES,1
TABELIONATO DE PROTESTO DE TITULOS DE MACHADO,1
NOUS SENSEMAKING,1
SECRETARIA MUNICIPAL DE EDUCACAO CULTURA ESPORTE,1
"UNIVERSIDADE FEDERAL DE UBERLANDIA, FACULDADE DE GESTAO E NEGOCIOS - FAGEN",1
FELIX & NAVARRO,1
UNIVERSIDADE FEDERAL DO MARANHAO - CAMPUS V,1
UNIVERSIDADE ESTADUAL DE PERNAMBUCO - FACULDADE DE CIENCIAS DA ADMINISTRACA,1
LABORATORIO DE IMUNOPATOLOGIA KEIZO ASAMI (LIKA),1
"PONTIFICIA UNIVERSIDADE CATOLICA DE SAO PAULO, FACULDADE DE DIREITO.",1
PROGRAMA DE POS-GRADUACAO EM ANTROPOLOGIA SOCIAL UFSC,1
NSC COMUNICACAO,1
PROGRAMA DE POS-GRADUACAO EM ANTROPOLOGIA SOCIAL DO MUSEU NACIONAL,1
INSTITUTO SUPERIOR POLITECNICO CAALA,1
UNION - CLINICA MEDICA E ODONTOLOGICA,1
AFYA EDUCACIONAL,1
CONCEICAO CARCARA ADVOCACIA E CONSULTORIA JURIDICA,1
HOSPITAL METROPOLITANO DOM JOSE MARIA PIRES,1
UNIVERSIDADE FEDERAL FLUMINENSE - POLO UNIVERSITARIO DE RIO DAS OSTRAS,1
FACULDADE DE ARQUITECTURA DA UNIVERSIDADE DO PORTO,1
UNIOESTE - UNIVERSIDADE ESTADUAL DO OESTE DO PARANA,1
CAMARA MUNICIPAL DE ARACATUBA,1
PREFEITURA DE CONCEICAO / PB - SECRETARIA MUNICIPAL DE SAUD,1
ACADEMIA DE POLICIA CIVIL DO ESTADO DE MINAS GERAIS,1
FEIS-UNESP,1
UNIBR,1
UNIVERSIDADE ESTADUAL DO OESTE DO PARANA - CAMPUS TOLEDO,1
IFGOIANO- CAMPUSRIO VERDE,1
INSTITUTO BRASILEIRO DO MEIO AMBIENTE E RECURSOS NATURAIS RENOVAVEIS,1
LABORATORIO DE DINAMICA DE SEDIMENTOS COESIVOS,1
TECNOLOGICO DE ANTIOQUIA,1
SIMWORX PESQUISA E DESENVOLVIMENTO DE PROGRAMAS DE COMPUTADOR,1
CENTRO UNIVESITARIO UNIFACVEST,1
MINICLIP,1
MUSSO SOCIEDADE INDIVIDUAL DE ADVOCACIA,1
PROGRAMA MUNDIAL DE ALIMENTOS/ WORLD FOOD PROGRAMME,1
GEISTLICH PHARMA DO BRASIL COMERCIO E SERVICOS DE PRODUTOS PARA SAUDE LTDA.,1
"FUNDACAO GETULIO VARGAS, ESCOLA DE ADMINISTRACAO DE EMPRESAS DE SAO PAULO.",1
"CASE WESTERN RESERVE UNIVERSITY, CLEVELAND OH, USA",1
CLEVER BUSINESS ENGENHARIA DA COMPUTACAO E AMBIENTAL,1
FRACTAL NUCLEO DE AVALIACAO PSICOLOGICA,1
INSTITUT NATIONAL DE RECHERCHE EN INFORMATIQUE ET EN AUTOMATIQUE - SIEGE,1
CINICA BAROS,1
PEDRO BINS ELY - CONSULTORIO PRIVADO DE CIRURGIA PLASTICA,1
PREFEITURA MUNICIPAL DE PASSIRA,1
COLEGIO ESTADUAL PROFESSOR NARCISO MENDES EFM,1
"DVDT STARTEC PESQUISA, DESENVOLVIMENTO & CAPACITACAO PROFISSIONAL",1
FUNDACAO CRIANCA DE SAO BERNARDO DO CAMPO,1
ESCRITORIO DE CONTABILIDADE ROSALY MACHADO,1
FUNDACAO DE PROTECAO ESPECIAL DO RGS,1
UNIVERSIDADE FEDERAL DA PARAIBA - CAMPUS I,1
CENTRO DE DESENVOLVIMENTO DA TECNOLOGIA NUCLEAR DA CNEN,1
ILIANI PATINHO,1
NUCLEO DE HEMATOLOGIA E ONCOLOGIA,1
ESCOLA SECUNDARIA DE PEMBA,1
UNIVERSIDADE FEERAL DE ALAGOAS,1
SECRETARIA DE ESTADO DE EDUCACAO -PA,1
FACULDADES METROPOLITANAS UNIDAS,1
CLINICA ESPACO ORIGEM,1
"UNIVERSITY OF TENNESSEE, KNOXVILLE",1
INSTITUTO ALERGOIMUNO DE AMERICANA,1
"INSTITUTO FEDERAL GOIANO, IF GOIANO - CAMPUS RIO VERDE.",1
COLEGIO NOSSA SENHORA DO CARMO - JF,1
MINISTERIO EXTRAORDINARIO DE SEGURANCA ALIMENTAR E COMBATE A FOME,1
INSTITUTO BRASILIENSE DE OTORRINOLARINGOLOGIA,1
SECRETARIA MUNICIPAL DE EDUCACAO / PALMAS,1
"INSTITUTO FEDERAL DE EDUCACAO, CIENCIA E TECNOLOGIA DO CEARA CAMPUS ARACATI",1
PREFEITURA MUNICIPAL DE GUARANI DAS MISSOES,1
SECRETARIA DE ESTADO DO DESENVOLVIMENTO SUSTENTAVEL DO PARANA,1
AGRO AMBIENCIA,1
HILARIAO & NEVES ADVOGADOS,1
FATEC NILO DE STEFANI JABOTICABAL - SP,1
CCR RODOVIAS,1
UNIVERSIDADE FEDERAL DA FRONTEIRA SUL - CAMPUS CERRO LARGO,1
LEONFORTE ASSESSORIA E CONSULTORIA DE ENGENHARIA,1
CENTRO BRASILEIRO DE REQUALIFICACAO FLUVIAL,1
SISTEMA FIERGS - SESI,1
CEDERJ POLO PARACAMBI,1
49.696.749 TELMA MEDEIROS BRITO,1
"UNIVERSIDADE FEDERAL RURAL DE PERNAMBUCO, PROGRAMA DE POS-GRADUACAO EM ECOL",1
INSTITUTO DE NEUROCIRURGIA E CIRURGIA DA COLUNA LTDA,1
ESCOLA MUNICIPAL PERA FLOR,1
ADVOCACIA JULIO CESAR LOPES,1
WESTMINSTER THEOLOGICAL SEMINARY,1
THON & YANO ESPACO MAIS SAUDE LTDA,1
ANELISE ASSUMPCAO ADVOCACIA,1
HOSPITAL REGIONAL MONSENHOR ANTONIO BARROS,1
INSTITUTO DE OFTALMOLOGIA CANCADO TRINDADE,1
DEPARTAMENTO DE EPIDEMIOLOGIA,1
FP-ENAS / UNIVERSIDADE FERNANDO PESSOA,1
IFBA - CAMPUS VALENCA,1
CONSULTORIO MEDICO ESM EIRELI,1
"INSTITUTO FEDERAL DE EDUCACAO, CIENCIA E TECNOLOGIA - CAMPUS SERTAOZINHO",1
PREFEITURA MUNICIPAL DE FAZENDA VILANOVA,1
"UNIVERSITY OF NEVADA, LAS VEGAS",1
CENTRO DE PESQUISAS RENE RACHOU (FIOCRUZ MINAS),1
GAUTICA TECNOLOGIA EM INFORMACAO,1
HOSPITAL DAS CLINICAS DA FACULDADE DE MEDICINA UNIVERSIDADE DE SAO PAULO,1
PONTIFICIA UNIVERSIDADE CATOLICA - PUC/SP - FACULDADE DE DIREITO,1
HOSPITAL DIVINA PROVIDENCIA,1
ARANTES & ASSOCIADOS,1
UNIVERSIDADE FEDERAL DO RECONCAVO BAIANO,1
CEFET - ANGRA DOS REIS,1
UNIVERSIDADE ESTADUAL DO PARANA- CAMPUS FAFIPAR,1
UNIAO CRISTA ? ASSOCIACAO SOCIAL E EDUCACIONAL,1
CENTRO DE APOIO EM PATOLOGIA,1
FACULDADE  DE PINDAMONHANGABA,1
TRIBUNAL REGIONAL DO TRABALHO DA 2 REGIAO SP,1
SECRETARIA MUNICIPAL DE EDUCACAO DE CAMPOS BELOS,1
CARBONAIR ENERGY,1
ESCOLA SUPERIOR DE ADVOCACIA DA OAB ? SECAO SP,1
FACULDADE DE MEDICINA DE BOTUCATU - FMB - UNESP,1
HOSPITAL REGIONAL DE CACERES,1
AGENCIA DE DEFESA E INSPECAO AGROPECUARIA DO ESTADO DO AMAPA,1
UNIVERSITE DU QUEBEC A CHICOUTIMI,1
SECRETARIA ESTADUAL DE SAUDE PUBLICA DO RN,1
FAVI - INSTITUTO DE ENSINO SUPERIOR,1
LET'S - NEURODESENVOLVIMENTO PARA CRIANCAS E ADOLESCENTES,1
ESCOLA ESTADUAL DE ENSINO MEDIO DOM ANTONIO REIS,1
INSTITUTO LANGAGE,1
FACULDADE NOVA ROMA,1
ADVOCACIA E IMOVEIS RUDIMAR RIBEIRO,1
COLEGIO ESTADUAL PROFESSORA OFENISIA SOARES FREIRE - ARACAJU/SERGIPE,1
INSTITUTO DE CIENCIAS MATEMATICAS E DE COMPUTACAO USP,1
CENTRO UNIVERSITARIO HERMINIO OMETTO - UNIARARAS,1
CENTRO DE ESTUDOS EM SUSTENTABILIDADE DA EAESP/FGV,1
DESENVOLVIMENTO SUSTENTAVEL E MONITORAMENTO AMBIENTAL,1
ESCOLA ESTADUAL DE ENSINO FUNDAMENTAL E MEDIO PROF EDDA DE SOUSA GONCALVES,1
UNISAGRADO ? CENTRO UNIVERSITARIO SAGRADO CORACAO,1
BUCO-FACIAL SERVICOS DE SAUDE LTDA,1
CONGREGACAO SAGRADA FAMILIA DE BERGAMO,1
BRITO CHAVES ADVOGADOS ASSOCIADOS,1
COLEGIO ESTADUAL PROFESSORA MARIA BERNADETE BRANDAO,1
UNIAO DE FACULDADES METROPOLITANAS DE MARINGA,1
"OREGON HEALTH AND SCIENCE UNIVERSITY, SCHOOL OF DENTISTRY",1
CENTRO DE ESTUDOS EM EDUCACAO E SOCIEDADE,1
ESCOLA MUNICIPALIZADA TIRO DE GUERRA,1
HOSPITAL INFANTIL E MATERNIDADE ALZIR BERNARDINO ALVES,1
SECRETARIA DO ESTADO DE SAUDE DO DF,1
UFBA-UNIVERSIDADE FEDERAL DA BAHIA,1
JANSSEN-CILAG FARMACEUTICA,1
BLANCHET ADVOGADOS ASSOCIADOS,1
HOSPITAL ALIANCA,1
"CENTRO UNIVERSITARIO UNIME, UNIME.",1
"CONSELHO REGIONAL DE ENFERMAGEM DE SAO PAULO, CORENSP, BRASIL.",1
SUPETINTENDENCIA DA POLICIA TECNICO-CIENTIFICA DE GOIAS,1
FIP - FACULDADES INTEGRADAS POTENCIAL,1
JULIA SERVICOS MEDICOS LTDA,1
INSTITUTO GNARUS,1
FGM - DENTSCARE,1
INSTITUTO JOGO LIMPO,1
HANDS4E CONSULTORIA AMBIDESTRA,1
SECRETARIA-GERAL DA PRESIDENCIA DA REPUBLICA,1
CENTRO UNIVERSITARIO MUNICIPAL DE FRANCA UNI-FACEF,1
INSTITUTO DE ENSINO CAMPO LIMPO PAULISTA S/C LTDA,1
MILTON IDE CONSULTORIA AGRICOLA,1
CENTRO FEDERAL DE EDUCACAO TECNICA E TECNOLOGICA,1
TAKEDA,1
INSTITUTO DE PESQUISA E DESENVOLVIMENTO - UNIVAP,1
UBS PREFEITO PRESTES MAIA,1
UNIVERSIDAD CENTRAL  MARTA ABREU DE LAS VILLAS,1
CATRAIA SOLUCOES AMBIENTAIS,1
ASSOCIACAO BRASILEIRA DE EDUCADORES LASSALISTAS,1
PRA HEALTH SCIENCE,1
NUCLEO DE APOIO EM EDUCACAO MEDICA CONTINUADA LTDA,1
AMBULATORIO BIAS FORTES/ UFMG,1
SISTEMA CATARINENSE DE COMUNICACOES,1
FACULDADE DE MEDICINA DA UFJF,1
FACULTAD DE MEDICINA,1
HION SOLUCOES E TECNOLOGIA,1
HFFITNESS - PROFISSIONAIS DE EDUCACAO FISICA LTDA,1
SERVICO DE NEUROLOGIA E NEUROCIRURGIA,1
CENTRO UNIVERSITARIO DAS FACULDADES ASSOCIADAS DE ENSINO-UNIFAE,1
MEDICENTER PETROPOLIS,1
UNIVERISDADE FEDERAL DE PERNAMBUCO,1
CENTRO DE RESQUISAS RENE RACHOU / FIO CRUZ,1
CGEO - COORDENACAO DE GEOPROCESSAMENTO DO IEMA,1
UNIVERSIDADE FEDERAL DO RIO GRANDE (FURG),1
EMPRESA BRASILEIRA DE AGRICULTURA,1
VTEX,1
FUNDACAO UNVERSITARIA DE ITAPERUNA,1
CONSULTORIO ODONTOLOGICO CILEA SLOMP,1
NUCLEO REGIONAL DE EDUCACAO DE UNIAO DA VITORIA,1
SECRETARIA DE PLANEJAMENTO E MOBILIDADE URBANA,1
SECRETARIA DA EDUCACAO E DA CIENCIA E TECNOLOGIA,1
UNIVERSIDADE ESTADUAL DO PARANA UNIAO DA VITORIA,1
INSTITUTO FEDERAL FARROUPILHA CAMPUS JULIO DE CASTILHOS,1
CAROLINA LINS - CIENCIA & FISIOTERAPIA AVANCADA,1
ESCOLA ESTADUAL JOSE ARAUJO FONSECA,1
"INSTITUTO  FEDERAL DE EDUCACAO, CIENCIAS E TECNOLOGIA-PESQUEIRA",1
CENTRO MEDICO VETERINARIO DA UNIFIO,1
CLINE RESEARCH CENTER,1
ATGC GENETICA AMBIENTAL LTDA.,1
FACULDADE DO CENTRO OESTE MATOGROSSENSE,1
ASSEMBLEIA LEGISLATIVA DO ESTADO DE MINHAS GERAIS,1
ESCOLA ESTADUAL PROFESOR JOAO BATISTA,1
COLEGIO BRIGADEIRO NEWTON BRAGA,1
ASSOCIACAO PAULISTA DE CIRURGIOES DENTISTAS DA REGIAO DE RIBEIRAO PRETO,1
"INSTITUTO DE PESQUISAS ENERGETICAS E NUCLEARES, CENTRO DE CELULAS A COMBUST",1
HOSPITAL DAS CLINICAS DA UNIVERSIDADE FEDERAL DE UBERLANDIA,1
E.E. PROFESSORA MARIA OSCARINA SILVA PEREIRA,1
SECRETARIA MUNICIPAL DE EDUCACAO DE PARAUAPEBAS,1
INTERNATIONAL BUSINESS MACHINE BRASIL,1
FACULDADE DO PIAUI,1
ESCOLA DE ENSINO FUNDAMENTAL E MEDIO CONEGO LEITAO,1
NUCLEO INTERDISCIPLINAR DE ESTUDOS SOBRE DESIGUALDADE,1
LUNELLI ARTE - EDUCACAO,1
INSTITUTO FEDERAL DE ALAGOAS (CAMPUS PIRANHAS),1
ESCOLA SUPERIOR DE CRUZEIRO ?PREFEITO HAMILTON VIEIRA MENDES?,1
LABORATORIO DE MACROMOLECULAS E COLOIDES NA INDUSTRIA DE PETROLEO,1
SECRETARIA ESTADUAL DA SAUDE - RS,1
MERIAL SAUDE ANIMAL,1
FACULDADE DE ENGENHARIA DE ALIMENTOS (UNICAMP),1
COLEGIO ESTADUAL DO CAMPO DE BOTUPORA,1
GRANJA XEREZ,1
GOVERNO DE HONDURAS,1
"SECRETARIA MUNICIPAL DE DESENVOLVIMENTO SOCIAL, TRABALHO E HABITACAO.",1
COLEGIO ESTADUAL PROFESSOR FRANCISCO VILLANUEVA,1
GRUPO AMBIENTALISTA NASCENTES,1
PREFEITURA  MUNICIPAL DE SANTOS,1
ADVOCACIA FRANCO DE LIMA,1
UNIVERSIDADE DE SAO PAULO - FACULDADE DE DIREITO DO LARGO DE SAO FRANCISCO,1
ETEP FACULDADES,1
UNIVERSITA CATTOLICA  DEL SACRO CUORE,1
IFMA CAMPUS CODO,1
IRMANDADE SANTA CASA DE PORTO ALEGRE,1
ESCOLA LA SALLE ESMERALDA,1
ESCOLA DE APERFEICOAMENTO DE OFICIAIS,1
UNIVERSIDADE ROVUMA - EXTENSAO DE CABO DELGADO,1
UNIVERSIDADE DO ESTADO DO RIO DE JANEIRO - FAT,1
"AGENCIA GOIANA DE ASSISTENCIA TECNICA, EXTENSAO E PESQUISA AGROPECUARIA",1
UNIVERSIDADE FEDERAL DE ALFENAS - MG,1
UNIVERSITE CLAUDE BERNARD LYONI,1
MARCOS EBERHARDT ADVOGADOS ASSOCIADOS,1
DEPARTAMENTO DE BIENESTAR Y SALUD,1
ENGENHARIA AMBIENTAL E SANITARIA,1
CENTRO ESPECIALIZADO EM NEUROMODULACAO,1
CENTRO UNIVERSITARIO CATOLICO SALESIANO AUXILIUM - UNISALESIANO ARACATUBA/S,1
EMPRESA BRASILEIRA DE PESQUISA AGROPECUARIA - AGROINDUSTRIA TROPICAL,1
SEA GRANT,1
UNIVERSIDADE TECNOLOGICA FEDERAL DO PARANA CAMPUS DOIS VIZINHOS,1
"INSTITUTO FEDERAL DE EDUCACAO, CIENCIA E TECNOLOGIA DO CEARA CAMPUS CRATEUS",1
UNIVERSIADE FEDERAL DE MINAS GERAIS,1
OFTALMOLOGIA E NEUROCIRURGIA INSTITUTO,1
LABORATORIO DE DERMATO-IMUNOLOGIA UFPA/MC,1
FACULDADE DE CIENCIAS FARMACEUTICAS DE ARARAQUARA UNESP,1
CASA DA MOEDA DO BRASIL,1
UNIVERSIDADE EATADUAL DO PIAUI,1
CENTRO UNIVERSITARIO LS,1
UNIVERSIDAD NACIONAL DE LOJA,1
UNIVERSITY OF WEST BOHEMIA,1
FACULDADE DE TECNOLOGIA E CIENCIAS DE VITORIA DA CONQUISTA,1
"PREFEITURA DE CUBATAO, SECRETARIA DE EDUCACAO",1
CONSERVATORIO DRAMATICO E MUSICAL DE TATUI,1
INSTITUTO DE RADIOLOGIA DA FACULDADE DE MEDICINA DA USP,1
ORI CONSULTORIA E TREINAMENTO EM GESTAO,1
BETH ISRAEL DEACONESS MEDICAL CENTER / HARVARD MEDICAL SCHOOL,1
SECRETARIA MUNICIPAL DE EDUCACAO DE CALDAS NOVAS,1
FABRICIO VEIGA COSTA ADVOCACIA CIVEL,1
FUNDACAO UNIVERSITARIA IBEROAMERICANA - FLORIANOPOLIS,1
COMPANHIA DE PESQUISA DE RECURSOS MINERAIS (REGIONAL MANAUS),1
UNIVERSIDADE ESTADUAL PAULISTA/FACULDADE DE CIENCIAS AGRARIAS E VETERINARIA,1
UNESPAR - FACULDADE DE ARTES DO PARANA,1
