NOME-INSTITUICAO-EMPRESA,QUANTIDADE
UNIVERSIDADE FEDERAL DE SANTA MARIA (UFSM) - COLEGIO POLITECNICO DA UFSM.,1
COMPANHIA DE INFORMATICA DO PARANA,1
ACADEMIA HI,1
HOSPITAL REGIONAL DO GAMA,1
CENTRO UNIVERSITARIO POSITIVO,1
INSTITUTO POLO INTERNACIONAL IGUASSU,1
INSTITUTO FEDERAL FLUMINENSE - MACAE,1
LALLEMAND PLANT CARE BRASIL,1
UNIOESTE CAMPUS MARECHAL CANDIDO RONDON,1
INCOR HOSPITAL DAS CLINICAS  FACULDADE DE MEDICINA UNIVERSIDADE DE SAO PAUL,1
BIOLOGIC CONSULTORIA AMBIENTAL LTDA.,1
FACULDADES SANTA CRUZ,1
CORPO DE BOMBEIROS DO ESTADO DO RIO DE JANEIRO,1
SECRETARIA  DE ESTADO DE EDUCACAO,1
HOSPITAL UNIVERSITARIO- UNIVASF,1
REDE ECLESIAL PAN-AMAZONICA,1
CENTRO DE ENSINO SUPERIOR DE CONSELHEIRO LAFAIETE,1
UNIVERSIDADE CANDIDO MENDES (CAMPOS),1
CENTRO DE INVESTIGACAO EM PSICODINAMICA,1
SECRETARIA MUNICIPAL DE SAUDE DE PORTO VELHO,1
HOSPITAL DAS CLINICAS DA FACULDADE DE MEDICINA DE RIBEIRAO PRETO-USP-HCFMRP,1
INSTITUTO DE BOTANICA DE SAO PAULO,1
SECRETARIA DE SAUDE DE CARUARU,1
ASSOCIACAO BRASILEIRA DE ODONTOLOGIA - SECAO DE GOIAS,1
ESCOLA ESTADUAL DE ENSINO MEDIO 20 DE SETEMBRO,1
INSTITUTO DE PESQUISA E ENSINO EM OFTALMOLOGIA,1
BALQ TECH,1
CENTRO JUDICIARIO DE SOLUCAO DE CONFLITOS E CIDADANIA DE CAMPO DO BRITO -SE,1
SECRETARIA DE ESTADO DA SAUDE DE GOIAS (SES-GO),1
TOHOKU UNIVERSITY,1
FATEC SAO JOSE DOS CAMPOS,1
BAGAGLI E MORENO ADVOCACIA,1
UNIVERSIDADE ESTADUAL DO PARANA/UNESPAR - CAMPUS PARANAVAI,1
INSTITUTO TECNOLOGICO SIMEPAR SISTEMA METEOROLOGICO DO PARANA,1
LABORATORIO DE IMUNOGENETICA E BIOLOGIA MOLECULAR,1
UNIVERSIDADE DO ESTADO DO RIO DE JANEIRO-CAMPUS ZONA OESTE.,1
INSTITUTO NACIONAL DE CARDIOLOGIA DE LARANJEIRAS,1
UNIVERSIDADE IGUACU-CAMPUS V-ITAPERUNA-RJ,1
RS CONSULTORIA AMBIENTAL,1
CONSULTORIO MEDICO ODONTOLOGICO,1
AMERIO ALMEIDA & ADVOGADOS ASSOCIADOS,1
FUNDACAO DE APOIO AO DESENVOLVIMENTO DA  COMPUTACAO CIENTIFICA,1
DUPONT DO BRASIL S.A. - DIVISAO PIONEER SEMENTES,1
UNIVERSITY MEDICAL CENTER HAMBURG-EPPENDORF,1
POLICIA CIVIL/RS,1
CONSULTORIO ODONTOLOGICO DR. MARCIO DE CARVALHO FORMIGA,1
TRIBUNAL DE JUSTICA DE PERNAMBUCO - TJ/PE,1
ESCOLA MUNICIPAL GUSTAVO BARROSO,1
MYDIGICARE PRESTACAO DE SERVICOS FARMACEUTICOS,1
SECRETARIA DO ESTADO DE SAUDE DE MATO GROSSO,1
JULIANE C. BORSA LTDA - CONSULTORIO DE PSICOLOGIA,1
E E JOAO JOSE DE ALMEIDA FILHO,1
GOMES & TIBURTINO ADVOGADOS ASSOCIADOS,1
SECRETARIA DE SAUDE PUBLICA DO RIO GRANDE DO NORTE,1
CENTRO CLINICO DO HOSPITAL MAE DE DEUS,1
INSTITUTO FEDERAL GOIANO-CAMPUS CERES,1
HOSPITAL DE CARIDADE ERECHIM,1
EUBIOTIC TECNOLOGIA ANIMAL SUSTENTAVEL,1
CENTRO INTEGRADO DE ONCOLOGIA DO HOSPITAL MAE DE DEUS,1
INSTITUTO JAREDE,1
HOSPITAL UNIVERSIDADE JOAO DE BARROS BARRETO,1
EMPRESA BRASILEIRA DE PESQUISA AGROPECUARIA - CENTRO NACIONAL DE PESQ. SOJA,1
TRIBUNAL DE JUSTICA DO ESTADO DE ALAGOAS,1
CENTRO ODONTOLOGICO DE ORTOPEDIA FUNCIONAL PYRAMO E SANTIAGO,1
ESCOLA MUNICIPAL WALDEMAR FALCAO,1
DEPARTMENT OF CHEMISTRY,1
PREFEITURA MUNICIPAL DE BURITIS - RO,1
"INSTITUTO DE QUIMICA DE SAO CARLOS, UNIVERSIDADE DE SAO PAULO",1
ESCOLA DE ENSINO FUNDAMENTAL OITICICAS,1
"UNIVERSIDADE ESTADUAL PAULISTA JULIO DE MESQUITA FILHO, CENTRO DE RAIZES E",1
UNIVERSITAT KLINIKUM JENA,1
APOSENTI APOSENTADORIAS,1
COMPANHIA DE AGUA E ESGOTO DA PARAIBA,1
OPTIONLINE SERVICOS DE INFORMACAO LTDA,1
VLIMA CLINICA ODONTOLIGA,1
INSTITUTO ADOLFO LUTZ - CLR BAURU II,1
NUCLEO REGIONAL NOROESTE DA SBCS,1
CENTRO ESTADUAL DE EDUCACAO TECNICA TALMO LUIZ SILVA,1
FACULDADE DE EDUCACAO E CIENCIAS DE CONTAGEM,1
"UNIVERSIDADE ESTADUAL DO OESTE DO PARANA, FRANCISCO BELTRAO",1
CIMERMAN ANALISES CLINICAS,1
PLUNES CENTRO MEDICO,1
TRIBUNAL REGIONAL FEDERAL DA 3 REGIAO - SAO PAULO,1
BEIFIUR LTDA.,1
VETCOR,1
NATURENERGY BETRIEBSFUHRUNG GMBH,1
CENTRO DE ENSINO EM PERIODO INTEGRAL ADONIRO MARTINS DE ANDRADE,1
HARDT PLANEJAMENTO S/S LTDA,1
HOSPITAL  REGIONAL MATERNO INFANTIL DE IMPERATRIZ,1
INSTITUTO FEDERAL DE GOIAS - CAMPUS INHUMAS,1
JORNAL IBIA,1
UNIVERSIDADE FEDERAL DO RIO DE JANEIRO - OBSERVATORIO DO VALONGO,1
INSTITUTO BRASILEIRO DE PSICOLOGIA,1
COLEGIO ESTADUAL ANACLETO DE MEDEIROS,1
HELMHOLTZ-INSTITUT FUR PHARMAZEUTISCHE FORSCHUNG SAARLAND,1
INSTITUTO MATERNO-INFANTIL PROF. FERNANDO FIGUEIRA,1
PKS EDUCACAO GEOTECNICA,1
EEEFM TEOFILO PAULINO,1
FUNDACAO CLOVIS SALGADO,1
ORION ENGENHARIA E SERVICOS LTDA,1
LABORATORIO RICHET,1
SERVICO DE APOIO AS MICRO E PEQUENAS EMPRESAS DE BELO HORIZONTE,1
CHARLES STURT UNIVERSITY,1
DIVISAO DE FAUNA SILVESTRE,1
TRIBUNAL REGIONAL ELEITORAL DO ESTADO DO AMAZONAS,1
UNIVERSIDADE DE SAO PAULO FACULDADE DE ZOOTECNIA E ENGENHARIA DE ALIMENTOS,1
SUBSISTEMA INTEGRADO DE ATENCAO A SAUDE DO SERVIDOR,1
INSTITUTO HARDWARE BR,1
GARCEZ ADVOGADOS ASSOCIADOS,1
KARINE VINCENZI,1
AGENCIA DEVELOP,1
KINGS COLLEGE,1
APERAM SOUTH AMERICA,1
IFPE- CAMPUS AFOGADOS DA INGAZEIRA,1
CENTRO UNIVERSITARIO MONTE SERRAT - UNIMONTE,1
COLEGIO ANGLO LEONARDO DA VINCI,1
POLICLINICA PATO BRANCO,1
CATALISE SOCIAL,1
CATAVENTO CULTURAL E EDUCACIONAL,1
SUBCOORDENADORIA DE EDUCACAO ESPECIAL,1
"JUSTICA FEDERAL EM SANTA CATARINA, SECAO JUDICIARIA DE FLORIANOPOLIS",1
HOSPITAL ESTADUAL LOUSITE FERREIRA DA SILVA,1
CLINICA ODONTOLOGICA PRIVADA,1
ESCOLA SUPERIOR AGRARIA,1
UNIVERSIDADE ESTADUAL DO PIAUI - FACIME,1
CLINICA DE ASSISTENCIA A SAUDE DO CASAL,1
INSTITUTO FEDERAL DO MATO GROSSO - CAMPUS CONFRESA,1
CLINICA NUTRICIONISTA MAIRA PINHO POMPEU,1
PREFEITURA MUNICIPAL DE CANGUCU,1
ESCOLA DE REFERENCIA EM ENSINO MEDIO GUEDES ALCOFORADO,1
FACULDADE DE FARMACIA DA UNIVERSIDADE FEDERAL DO RIO DE JANEIRO,1
USP/SAO CARLOS,1
GUEDES E TOLEDO SERVICOS MEDICOS LTDA,1
INSTITUTO MAURICIO NOGUEIRA LIMA,1
PREFEITURA MUNICIPAL DE TELEMACO BORBA,1
1 SERVICO DE REGISTRO DE IMOVEIS DE LONDRINA,1
NATIONAL INSTITUTE OF ENVIRONMENTAL HEALTH SCIENCES,1
USINA VALE DO PARANA,1
CASARIM MEDICINA LTDA.,1
AFYA FACULDADE DE CIENCIAS MEDICAS DE SANTA INES,1
CENTRO DE HEMATOLOGIA E ONCOLOGIA DE JAU,1
"UNIVERSIDADE FEDERAL DE SERGIPE,",1
FACULTAD DE HUMANIDADES Y CS DE LA EDUCACION/UDELAR,1
DATA EDUC,1
COLEGIO IDEAL,1
UNIVERSIDADE PAULISTA UNIP - CAMPUS JK -  SAO JOSE DO RIO PRETO,1
UNIVERSIDAD INTRUSTRIAL DE SANTANDER,1
SECRETARIA ESTADUAL DE SAUDE DO RIO GRANDE DO NORTE,1
INSTITUTO FEDERAL DE MINAS GERAIS - CAMPUS FORMIGA,1
EMEF BIRKHANN E TONON,1
MINISTERIO DA DEFESA- COMANDO DA MARINHA (RJ),1
FACULDADE UNIDAS DE CAMPINAS,1
COACIPAR-COOPERATIVA DE AGRICULTURA FAMILIAR E SOLIDARIA DO PARANA,1
MINISTERIO DA PREVIDENCIA SOCIAL,1
PREFEITURA MUNICIPAL DE GOVERNADOR VALADARES,1
UNIVERSIDADE PAULISTA - CAMPUS DE ARACATUBA,1
ARQUITETOS ASSOCIADOS,1
ELIAS NECHAR,1
FACULDADE NOVO HORIZONTE,1
CENTRO DE EDUCACAO E ASSESSORIA POPULAR,1
SECRETARIA DA AGRICULTURA DO ESTADO DO RIO GRANDE DO SUL,1
ESCOLA DE ENFERMAGEM UFMG,1
INSTITUTO DE ENSINO E PESQUISA HOSPITAL ISRAELITA ALBERT EINSTEIN,1
"ASSOCIACAO BENEFICENTE DA IND, CARB. SC",1
META ASSESSORIA E  SERVICOS TECNICOS,1
SECRETARIA DE DESENVOLVIMENTO URBANO E HABITACAO DO DISTRITO FEDERAL,1
EMBRAPA ALIMENTOS E TERRITORIOS,1
UNIVERSIDADE FEDERAL DE RONDONIA. CAMPUS DE ARIQUEMES,1
COMPLEXO HOSPITAL DE CLINICAS DA UFPR,1
NUCLEO MUNICIPAL DE EDUCACAO DE JOVENS E ADULTOS,1
FACULDADE DE MINAS - BELO HORIZONTE,1
COMPLEXO DO HOSPITAL DE CLINICAS DA UNIVERSIDADE FEDERAL DO PARANA,1
ALEXANDRE LINHARES SOCIEDADE DE ADVOGADOS,1
UNIVERSIDADE FEDERAL DE SAO CARLOS - CAMPUS LAGOA DO SINO,1
"UNIVERSIDADE FEDERAL DE SAO PAULO, CAMPUS GUARULHOS (SP)",1
PLANT COLAB PESQUISA E DESENVOLVIMENTO LTDA,1
MAX-PLANCK-INSTITUT FUR CHEMISCHE PHYSIK FESTER STOFFE,1
CENTRO UNIVERSITARIO FMU/FIAM-FAAM,1
FACULDADE DE TECNOLOGIA INTENSIVA,1
URBE OMNIS PLANEJAMENTO E GESTAO LTDA.,1
UNIVERSIDADE FEDERAL DO ESTADO DO RIO DEJANEIRO,1
COMMSCIENCE SOLUTIONS,1
UNIVERSIDADE ESTADUAL DE SANTA CRUZ - DCET,1
FACULDADE SENAI DE TECNOLOGIA MECATRONICA INDUSTRIAL,1
UNIVERSITY OF NORTH TEXAS,1
INSTITUTO DE PUERICULTURA E PEDIATRIA MARTAGAO GESTEIRA - UFRJ,1
EMPRESA BRASILEIRA DE SERVICOS HOSPITALARES - BAHIA,1
CENTRO INTERNACIONAL DE AGRICULTURA TROPICAL,1
PREFEITURA MUNICIPAL DE SERAFINA CORREA,1
EUROIMMUN BRASIL MEDICINA DIAGNOSTICA LTDA,1
EEB ALBA LUCY REIS MAGNUS,1
FACULDADE DE CIENCIAS HUMANAS EXATAS E DA SAUDE DO PIAUI,1
DIVISAO DE OTORRINOLARINGOLOGIA,1
PREFEITURA MUNICIPAL DE AURORA,1
ASSOCIACAO PAULISTA PARA DESENVOLVIMENTO DA MEDICINA,1
LABORATORIO CISCO,1
EAWAG - DUBENDORF,1
CONSORCIO  ESS BILBAO,1
CLINICA RADILALIS SANTA CASA,1
ONTARIO MINISTRY OF NATURAL RESOURCES AND FORESTRY,1
SECRETARIA MUNICIPAL DE SAUDE DE SERRINHA,1
M3 CONTABILIDADE E PLANEJAMENTO LTDA - ME,1
CDI - CENTRO DE DIAGNOSTICOS POR IMAGENS LTDA,1
EEEFM PROFESSOR JOSE GONCALVES DE QUEIROZ,1
SECRETARIA MUNICIPAL DE EDUCACAO - GOIANIA,1
INSTITUTO MEDICO LEGAL AFRANIO PEIXOTO,1
FUNDACAO EDUCACIONAL DO DISTRITO FEDERAL,1
TIGER CATS CONSERVATION INITIATIVE,1
SZAZI BECHARA STORTO REICHER FIGUEIREDO LOPES ADVOGADOS,1
LABORATORIO CENTRAL DE SAUDE PUBLICA DE MATO GROSSO DO SUL,1
LABORATORIO CENTRAL DE SAUDE PUBLICA DO CEARA,1
FATEC TATUI - PROFESSOR WILSON ROBERTO RIBEIRO DE CAMARGO,1
GOMES E  BARAO SOCIEDADE DE ADVOGADOS,1
"INCT/CNPQ - POLITICA PUBLICA, INOVACAO E DESENVOLVIMENTO URBANO",1
PREFEITURA DE BELO HORIZONTE/SECRETARIA MUNICIPAL DE SAUDE,1
CENTRO DE ENSINO EM PERIODO INTEGRAL INDEPENDENCIA,1
SOCIEDADE DE AMPARO AOS ANIMAIS DE UMUARAMA,1
INSTITUTO DE ESTUDOS SOCIAIS E POLITICOS DA UERJ,1
INSTITUTO NEUROVASCULAR,1
UNIVERSIDADE DO ESTADO DE MINAS GERAIS - UNIDADE DIVINOPOLIS,1
CEMEI CONCEICAO BONANI GAMA,1
INSTITUTO AGGEU MAGALHAES - FIOCRUZ - PE,1
FEEDBACK ASSESSORIA E CONSULTORIA EMPRESARIAL,1
INSTITUTE OF BOTANY OF THE CZECH ACADEMY OF SCIENCES,1
EE HELIO CERQUEIRA LEITE,1
MINISTERIO PUBLICO DO ESTADO DO CEARA (CE),1
DEPARTAMENTO DE ENGENHARIA QUIMICA DA UNIVERSIDADE DE COIMBRA,1
CONFEDERACAO BRASILEIRA DE SKATE,1
AGENCIA ESTADUAL DO SISTEMA PENITENCIARIO DE MATO GROSSO DO SUL,1
GRUPO LUTA PELA VIDA,1
SUTRO BIOPHARMA,1
UNIVERSIDAD DE LOS LLANOS,1
ASSOCIACAO DE POUPANCA E EMPRESTIMO DE SAO PAULO,1
CENTRO UNIVERSITARIO BRAZ CUBAS,1
INSTITUTO DE CIENCIA E TECNOLOGIA-CAMPUS DE SAO JOSE DOS CAMPOS-UNESP,1
CENTRO NACIONAL DE FOLCLORE E CULTURA POPULAR - IPHAN,1
PEACE RESEARCH INSTITUTE FRANKFURT,1
UNIVERSIDADE ESTADUAL DO SUDOESTE DA BAHIA - ITAPETINGA,1
CENTRO UNIVERSITARIO SANTA RITA,1
"INSTITUTO FEDERAL DE  EDUCACAO, CIENCIA E TECNOLOGIA DE MATO GROSSO",1
INSTITUTO ESTADUAL DE EDUCACAO NOSSA SENHORA IMACULADA,1
UNIVERSIDADE FEDERAL DO CEARA - CAMPUS CARIRI,1
OFICIO DE REGISTRO CIVIL E TABELIONATO DE NOTAS DE POPULINA (SP),1
INSTITUTO TECNOLOGICO DE AVALIACAO DO CORACAO,1
"INOVACAO, EDUCACAO E SOLUCOES TECNOLOGICAS",1
MARKESTRAT,1
ESCOLA SUPERIOR DE TEATRO E CINEMA DO INSTITUTO POLITECNICO DE LISBOA,1
COLEGIO GUTENBERG,1
INSTITUTO FEDERAL DO PARANA - CAMPUS ARAPONGAS,1
UNIVERSIDADE  DO ESTADO DE SANTA CATARIANA,1
TRIBUNAL REGIONAL DO TRABALHO DA QUARTA REGIAO,1
SECRETARIA MUNICIPAL DE ITAPETINGA-BA,1
PAMPLONA ALIMENTOS LTDA,1
IDEELAB BIOTECNOLOGIA LTDA,1
INSTITUTO FEDERAL DE SANTA CATARINA -CAMPUS GASPAR,1
ESCOLA IROMAR SILVA NOGUEIRA,1
UNIVERSITY OF GENEVA,1
INTERACTIO LAB,1
HL FILMES,1
MUSEU DE HISTORIA NATURAL DA UNIVERSIDADE FEDERAL DE ALAGOAS.,1
FACULDADE CESMA DE MARACANAU,1
CENTRO DE PESQUISAS RENE RACHOU - FIOCRUZ MINAS,1
MUNIZ E MACIEL ADVOCACIA E CONSULTORIA JURIDICA ESPECIALIZADA,1
ICAQF/UNIFESP DIADEMA,1
"ESCOLA SUPERIOR DE ADMINISTRACAO, MARKETING E COMUNICACAO - SOROCABA",1
HOSPITAL UNIVERSITARIO CLEMENTE DE FARIA,1
FAZENDA PARAISO,1
INDALECIO ROCHA ADVOCACIA,1
CENTRO DE IDIOMAS DO EXERCITO,1
MINISTERIO PUBLICO DO ESTADO DO AMAPA,1
SERVICO DE ONCOLOGIA DE UBERABA,1
PREFEITURA MUNICIPAL DE IRATI,1
COMPLEXO HOSPITAL DE CLINICAS - UFPR,1
HOSPITAL UNIVERSITARIO PEDRO ERNESTO-UERJ,1
PREFEITURA MUNICIPAL DE IGUAI,1
SUPERINTENDENCIA REGIONAL DE ENSINO - SRE - PATOS DE MINAS,1
CONSULTORIO DR. MARCELLO ALENCAR,1
NUCLEO DE EDUCACAO INFANTIL SONHO DE CRIANCA,1
SECRETARIA DE EDUCACAO E DA CULTURA DO RIO GRANDE DO NORTE,1
ASSOCIACAO DE ENSINO E CULTURA DO MATO GROSSO DO SUL,1
FEDERAL UNIVERSITY OF PERNAMBUCO,1
PREFEITURA MUNICIPAL DA EDUCACAO DE CURITIBA,1
TUCCI ADVOGADOS ASSOCIADOS,1
COLEGIO VICENTINO NOSSA SENHORA DAS GRACAS,1
ESCOLA ESTADUAL ANTONIO CANELA,1
ESCOLA DE ENSINO FUNDAMENTAL ST. PATRICK,1
"INSTITUTO FEDERAL DE EDUCACAO, CIENCIA E TECNOLOGIA - IFCE HORIZONTE",1
IBET INSTITUTO BRASILEIRO DE ESTUDOS TRIBUTARIOS,1
GERENCIA DE INSPECAO DE PRODUTOS DE ORIGEM VEGETAL - DIRETORIA TECNICA,1
INSTITUTO BW PARA A CONSERVACAO E MEDICINA DA FAUNA MARINHA,1
UNIVERSIDADE FEDERAL DE VICOSA-CAMPUS RIO PARANAIBA,1
SECRETARIA DE ESTADO DA JUSTICA E DA CIDADANIA E DIREITOS HUMANOS,1
INSTITUTO MATONENSE MUNICIPAL DE ENSINO SUPERIOR,1
CONSERVACAO E GESTAO PARTICIPATIVA DE RECURSOS DE USO COMUM,1
COLEGIO CONEXAO,1
PROCURADORIA DO MUNICIPIO DE JUIZ DE FORA,1
GRUPOS DE ESTUDOS E DESENVOLVIMENTO DE ALTERNATIVAS ENERGETICAS,1
PROCURADORIA-GERAL DA REPUBLICA / MINISTERIO PUBLICO FEDERAL,1
THAIS CATAN CONSULTORIA E MENTORIA,1
"INSTITUTO FEDERAL DE EDUCACAO, CIENCIA E TECNOLOGIA (CAMPUS BARREIROS)",1
GOTTFRIED WILHELM LEIBNIZ UNIVERSITAT HANNOVER,1
"INSTITUTO FEDERAL DE EDUCACAO, CIENCIA E TECNOLOGIA SUDESTE MINAS GERAIS",1
INDUSTRIAS MECANICAS ROCHFER LTDA,1
SUPERINTENDENCIA DE FISCALIZACAO,1
GRUPO DE ESPECIALIDADES MEDICAS,1
INSTITUTO NACIONAL DE PESQUISAS DO PANTANAL,1
UNIVERSIDAD ARTURO PRAT,1
FIRJAN INSTITUTO SENAI DE INOVACAO EM QUIMICA VERDE,1
GRUPO FOX CONCURSOS,1
ASSOCIACAO DOS AMIGOS DE SAO FRANCISCO DE SALES,1
LABORATORIO NACIONAL DE LUZ SINCROTRON,1
HC FOODS CONSULTORIA E TREINAMENTO,1
IDEIAS DEMAIS PRODUCOES,1
COLEGIO SINGULAR,1
MINISTERIO DO TRABALHO E PREVIDENCIA,1
SERVICO MUNICIPAL DE AGUA E ESGOTOS-SEMAE,1
UNA SETE LAGOAS,1
QUIMTIA S.A.,1
HOSPITAL DE CLINICAS GASPAR VIANA,1
UNIVERSIDADE ESTADUAL PAULISTA - FM - CAMPUS DE BOTUCATU,1
MEDINA OSORIO ADVOGADOS,1
COLEGIO MUNICIPAL ENGENHO DA PRAIA,1
CENTRO DE ESTUDOS DO GENOMA HUMANO E CELULASTRONCO,1
CLINICA DR. JOSE ALVES DA SILVEIRA,1
FACULDADE DE TECNOLGIA DA UNICAMP,1
LAMACHIA ADVOGADOS ASSOCIADOS,1
PREFEITURA MUNICIPAL DE NOVA IGUACU,1
DERMATOLOGIA SANITARIA DO ESTADO DO ACRE,1
INSTITUTO PAULISTA DE REFERENCIA EM OFTALMOLOGIA,1
ESCOLA ESTADUAL AFONSO ARINOS,1
HOSPITAL PRESIDENTE VARGAS,1
GERENCIA GERAL DE TECNOLOGIA DA PRODUTOS PARA SAUDE - GGTPS,1
UNIVERISIDADE IGUACU,1
UNIVERSIDAD CENTRAL &QUOT;MARTA ABREU&QUOT; DE LAS VILLAS,1
OTOCLINICA GIULLIANO LUCHI,1
SAVIATO AMBIENTAL,1
FACULDADE DE CIENCIAS HUMANAS E SOCIAIS DE FRANCA/ UNESP,1
ABLUO DESENVOLVIMENTO E COMERCIO DE SOLUCOES TECN,1
UNIVERSIDADE FEDERAL RURAL DE PERNAMBUCO/UNIDADE ACADEMICA DE GARANHUNS,1
HOSPITAL IPO,1
HOSPITAL DAS CLINICAS UNIVERSIDADE FEDERAL DE MINAS GERAIS,1
AGENCIA DE DEFESA AGROPECUARIA DO ESTADO DO TOCANTINS,1
FACULDADE DE CIENCIAS AGRARIAS DE ANDRADINA,1
PREFEITURA MUNICIPAL DE APUCARANA/PR,1
INSTITUTO DE QUIMICA - UNESP CAMPUS ARARAQUARA,1
CEEBJA GUARAPUAVA,1
"ESCOLA DE ARTES, CIENCIAS E HUMANIDADES -UNIVERSIDADE DE SAO PAULO",1
SANTA CASA OURINHOS ONCOLOGIA - HOSPITAL DR MONZILLO,1
"INSTITUTO FEDERAL DE EDUCACAO, CIENCIA E TECNOLOGIA DE SAO PAULO - CAMPUS S",1
UIVERSIDADE FEDERAL DO ESPIRITO SANTO,1
SUPERINTENDENCIA DO IPHAN EM RORAIMA,1
INSTITUTO RENE-RACHOU,1
PREFEITURA MUNICIPAL DE SANTA AMELIA,1
CONSELHO REGIONAL DE EDUCACAO FISICA DA 2 REGIAO,1
"INSTITUTO FEDERAL DE EDUCACAO, CIENCIA E TECNOLOGIA DE SA OPAULO",1
HOSPITAL VETERINARIO BOTAFOGO,1
PREFEITURA MUNICIPAL DE OURO BRANCO,1
CENTRO DE INVESTIGACION COOPERATIVA EN BIOMATERIALES,1
FACULDADE SERGIPANA,1
CENTRO FEDERAL DE EDUCACAO TECNOLOGICA DA PARAIBA,1
UNILAGO,1
INSTITUTO COUTO MAIA,1
INSTITUTO DE CIENCIA DA INFORMACAO/UNIVERSIDADE FEDERAL DA BAHIA,1
TRACOS E ENTRELACOS - ESPACO TERAPEUTICO,1
SECRETARIA DA SAUDE DO ESTADO DO TOCANTINS,1
CENTRO DE ESTUDOS E ENSAIOS DE RISCO E MODELAGEM AMBIENTAL,1
CENTRO EDUCACIONAL ESPACO INTEGRADO,1
BADESUL DESENVOLVIMENTO,1
CENTRO TECNOLOGICO DE CARVAO LIMPO - CTCL,1
FACULDADE DE ARQUITETURA E URBANISMO DA UFRJ,1
INSTITUTO DE PSIQUIATRIA-ASSISTENCIA/ENSINO/PESQUISA PROF CESAR WEBER,1
ANAME CIENCIA E TECNOLOGIA EM SAUDE INFANTIL LTDA,1
VIGILANCIA EM SAUDE,1
"EMPRESA BRASILEIRA DE PESQUISA AGROPECUARIA, EMBRAPA CLIMA TEMPERADO.",1
SECRETARIA MUNICIPAL DE EDUCACAO DE SAO JOSE DOS PINHAIS,1
UNIVERSIDADE DE CHILE,1
..,1
COMISSAO NACIONAL DE ENERGIA NUCLEAR-SP,1
INSTITUTO ESTADUAL DE EDUCACAO MARCILIO DIAS,1
SECRETARIA MUNICIPAL DE SAUDE - RIO VERDE/GO,1
VANDERBILT UNIVERSITY MEDICAL CENTER,1
FUNDACAO CENTRO FEDERAL DE ENSINO TECNOLOGICO DE OURO PRETO,1
ESCOLA DE BELAS ARTES DA UNIVERSIDADE FEDERAL DO RIO DE JANEIRO,1
CENTRO DE EDUCACAO PROFISSIONAL - SENAI LAJEADO,1
SECRETARIA DE ESTADO DA CULTURA DE GOIAS,1
UNVERSIDADE FEDERAL DOS VALES DO JEQUITINHONHA E MUCURI,1
UNIVERSIDADE EDUARDO MONDLANE-ESCOLA SUPERIOR DE DESENVOLVIMENTO RURAL,1
UNISA,1
ESCRITORIO DE ADVOCACIA CARLA FROENER,1
SECRETARIA MUNICIPAL DE SAUDE - UBERLANDIA,1
FARMACIA BOA SAUDE,1
DEPARTAMENTO DE IMUNOBIOLOGIA,1
SECRETARIA DE ESTADO DA EDUCACAO DO ESPORTE E DO LAZER DO RIO GRANDE DO NOR,1
DIRETORIA DE PROGRAMAS DE PESQUISA E DESENVOLVIMENTO,1
UNIVERCIDADE FEDERAL DE CAMPINA GRANDE,1
FACULDADE DE MEDICINA DA UNIVERSIDADE AGOSTINHO NETO,1
FACULDADE DE CIENCIAS SOCIAIS DE GUARANTA DO NORTE,1
DATABASED MARKETING,1
INSTITUTO FAL,1
CLINICA NEUROLOGIA E PSIQUIATRIA,1
COLEGIO PROVINCIA DE SAO PEDRO,1
TECHNOLOGICAL UNIVERSITY OF THE SHANNON,1
UNIVERSIDADE FEDERAL FLUMINENSE - POLO UNIVERSITARIO RIO DAS OSTRAS,1
CAMARA MUNICIPAL DE SAO SEBASTIAO,1
AGU - SUPERINTENDENCIA DE ADMINISTRACAO NO ESTADO DE SAO PAULO,1
COORDENADORIA DE DEFESA AGROPECUARIA DE SAO PAULO,1
HELDER NASCIMENTO ADVOGADOS,1
ZHEJIANG UNIVERSITY,1
BELARMINO SOCIEDADE DE ADVOGADOS,1
UNIVERSIDADE CATOLICA PORTUGUESA,1
INST. P/O DESENV. SUSTENT.E CIDAD.DO VALE RIBEIRA,1
EEFM IRAPUAN CAVALCANTE PINHEIRO,1
NUTROPAR,1
INSTITUTO DE CARDIOLOGIA DE CRUZ ALTA,1
UNIVERSIDADE DE SAO PAULO - INSTITUTO DE BIOCIENCIAS,1
INSTITUTO FEDERAL DE EDUCACAO DO ESPIRITO SANTO - CAMPUS SERRA,1
SECRETARIA DE ESTADO DE EDUCACAO  E QUALIDADE DE ENSINO,1
SECRETARIA MUNICIPAL DE EDUCACAO E ESPORTES DE ESTEIO,1
METAURA PRESTACAO DE SERVICOS DE PESQUISA E DESENVOLVIMENTO LTDA.,1
EEM MANUEL SATIRO,1
DFV SERVICOS DE NEUROLOGIA E NEUROCIRURGIA S C LTDA,1
DAEMON PLANEJAMENTO E CONTROLE,1
NYU GROSSMAN SCHOOL OF MEDICINE,1
CUIDADO INTEGRAL TERAPIAS INTEGRATIVAS LTDA,1
UNIT - CENTRO UNIVERSITARIO TIRADENTES,1
UNIVERSIDADE DA CORUNA,1
INSTITUTO DE PSIQUIATRIA DA FACULDADE DE MEDICINA DA UNIVERSIDADE USP,1
COMPANHIA ESPIRITO SANTENSE DE SANEAMENTO,1
MM OPTICS,1
ETEC &QUOT;LUIZ CESAR COUTO,1
ODONTOLOGIA ROBSON REZENDE,1
ESCOLA ESTADUAL ENSINO MEDIO PEDRO ROSA,1
UNIVERSIDADE FEDERALDE RONDONIA,1
EDITORA CONSTRUIR,1
FABRICIO LINARDI ARQUITETURA E URBANISMO,1
UNIVERSIDAD NACIONAL DEL NORDESTE,1
HAJ MUSSI & BECUE ADVOGADOS ASSOCIADOS,1
CENTRO MEDICO DE OFTALMOLGIA,1
PREFEITURA MUNICIPAL DE ALVORADA,1
INSTITUTO DE CIRURGIA MINIMAMENTE INVASIVA,1
PARECIS AMBIENTAL,1
FUNDACAO PRO-RIM,1
INSTITUTO DE CIENCIA E TECNOLOGIA DO SUL DE MINAS - CAMPUS MUZAMBINHO,1
HOSPITAL GERAL CLERISTON ANDRADE,1
UNIVERSITE D'ORLEANS - LAB. D'INFORMATIQUE FONDAMENTALE D'ORLEANS (LIFO),1
FACULDADE AFONSO CLAUDIO,1
CONSULTORIO PROF. PAULO G. KOTZE,1
COLEGIO ANTARES,1
HOSPITAL REGIONAL DO SUL  DE MINAS,1
CENTRO DE PESQUISA CLINICA DO HOSPITAL UNIVERSITARIO DA USP,1
BRLDIGITAL SA,1
FUNDACAO DE APOIO AO HOSPITAL DAS CLINICAS DA UNIVERSIDADE FEDERAL DE GOIAS,1
LABORATORIO CENTRAL DE SAUDE PUBLICA DO ESPIRITO SANTO,1
GEORGIA CENTRAL UNIVERSITY,1
LABORATORIO DE REPTEIS,1
AGRUM - AGROTECNOLOGIAS INTEGRADAS LTDA.,1
GERIAVIDA,1
GEOHIDRICA - GEOLOGIA E MEIO AMBIENTE LTDA,1
CENTRO DE CIENCIAS DO MAR,1
"FIOCRUZ PERNAMBUCO, CAMPUS UFPE",1
INSTITUTO GEOFISICO DEL PERU,1
HARRISON LEITE ADVOGADOS ASSOCIADOS,1
SECRETARIA MUNICIPAL DE CULTURA E TURISMO,1
FACULDADE DE MEDICINA DO VALE DO ACO,1
INSTITUTO DA CRIANCA DO HOSPITAL DAS CLINICAS,1
SECRETARIA DE PLANEJAMENTO E GESTAO DE PERNAMBUCO,1
"DEPTO. PATOLOGIA, FMVZ-USP",1
R-CRIO CRIOGENIA S.A.,1
UNIVERSIDADE DO ESTADO DO PARA - CAMPUS XX - CASTANHAL,1
"FACULDADE DE FILOSOFIA, LETRAS E CIENCIAS HUMANAS-USP",1
"UNIVERSIDADE PAULISTA JULIO DE MESQUITA FILHO, FCAV, BRASIL.",1
UNIVERSIDADE PAULISTA DE ENSINO,1
CENTRO FEDERAL DE EDUCACAO TECNOLOGICA DEMINAS GERAIS,1
CENTRO DE PESQUISA DA UNIVERSIDADE POSITIVO,1
JG NUTRICAO SISTEMICA LTDA,1
SUPERINTENDENCIA DE POLICIA TECNICO-CIENTIFICA (GO),1
UNIVERSIDADE EVANGELICA DE GOIAS - UNIEVANGELICA,1
"ANGIOLOGICA - CLINICA DE ANGIOLOGIA, CIRURGIA VASCULAR E ENDOVASCULAR",1
INSTITUTO NACIONAL DE SALUD,1
DIRETORIA DE PATRIMONIO HISTORICO E DOCUMENTACAO DA MARINHA,1
LINCOLN MARCELLOS ADVOGADOS ASSOCIADOS,1
CEEBJA - APUCARA - PROFA LINDA E A MIYADI-EFM,1
PHYSIQUE - CENTRO DE FISIOTERAPIA,1
PEDRO ALBERTO CARDOSO SAMUEL ADVOGADOS,1
EQUALYS SOLUCOES PARA ANALISES AMBIENTAIS LTDA,1
ILMD - FIOCRUZ AMAZONIA,1
INSTITUTO FEDERAL DO SUDESTE DE MINAS GERAIS-CAMPUS RIO POMBA,1
6 GBM,1
CEPI MARIA RIBEIRO CARNEIRO,1
ESCOLA MUNICIPAL INDIGENA GUARANI KYRINGUE ARANDUA,1
UNIVERSIDAD DE LA SABANA,1
CENTRO DE FILOSOFIA E CIENCIAS HUMANAS,1
PROCURADORIA GERAL DO MUNICIPIO (PGM),1
"SECRETARIA MUNICIPAL DE AGRICULTURA, PECUARIA E ABASTECIMENTO DE TAILANDIA",1
INSTITUTO METODISTA GRANBERY,1
"INSTITUTO DE BIOCIENCIAS, LETRAS E CIENCIAS EXATAS DE SAO JOSE DO RIO PRETO",1
INSTITUTO FLORESTAL  SMA SP,1
ESCOLA ESTADUAL QUINTINO BOCAIUVA,1
NOGUEIRA PRODUCOES MUSICAIS,1
ACADEMIA DE POLICIA CIVIL DE SAO PAULO,1
LATICINIOS VALE DOS BURITIS,1
UNIVERSIDADE FEDERAL DOS VALES DO JEQUITINHONA E MUCURI,1
CONSISTEM - CONSULTORIA E SISTEMAS,1
UEFS -UNIVERSIDADE DE FEIRA DE SANTANA,1
UNISCIENCE DO BRASIL,1
SIMONELLI MOREIRA ADVOGADOS ASSOCIADOS,1
COLEGIO ESTADUAL JOSE PALLES SOBRINHO,1
SINERGIA SISTEMA DE ENSINO LTDA,1
THE BOEING COMPANY,1
DA COSTA ODONTOLOGIA AVANCADA,1
GULA ALIMENTOS,1
"RV SALLUS CLINICA DE PSICOLOGIA, ENSINO E PESQUISA",1
INSTITUTO DE PSICOLOGIA BASEADA EM EVIDENCIAS,1
ASTON UNIVERSITY,1
"MARINHA DO BRASIL, CENTRO DE EDUCACAO FISICA ALMIRANTE ADALBERTO NUNES.",1
RENECO INTERNATIONAL WILDLIFE CONSULTANTS,1
INSTITUTO FEDERAL DO SUDESTE DE MINAS GERAIS - CAMPUS MURIAE,1
"SECRETARIA MUNICIPAL DE AGROPECUARIA, ABASTECIMENTO E DISTRITOS",1
AFYA FACULDADE DE CIENCIAS MEDICAS DE PALMAS - TO,1
"UNIVERSIDADE FEDERAL DO PARA, LABORATORIO DE BIOLOGIA MOLECULAR",1
J.C.L. TELLES ADVOCACIA,1
CENTRO DE ESPECIALIDADES ODONTOLOGICAS DRA. MARIA DE LOURDES MASSAKO MINEI,1
MWM INTERNATIONAL MOTORES,1
CENTRO DE ORNITOLOGIA Y BIODIVERSIDAD,1
PREFEITURA DE PARANAVAI - PR,1
INSTITUTO DE EDUCACAO DE MINAS GERAIS,1
FACULDADE DE TECNOLOGIA DE RIO PRETO,1
UNIVERSIDAD CIENTIFICA DEL SUR,1
PRIME SAUDE - FISIOTERAPIA E MEDICINA LTDA,1
"HOSPITAL ISRAELITA ALBERT EINSTEIN, SERVICO DE HEMATOLOGIA",1
VASSAR COLLEGE,1
INSTITUTO FEDERAL DO NORTE DE MINAS GERAIS - CAMPUS PIRAPORA.,1
EMEF LEDUVINA DA ROSA ROSSI,1
TRIBUNAL REGIONAL DO TRABALHO DA 01 REGIAO (RJ),1
FACULDADE DE ODONTOLOGIA DE RIBEIRAO PRETO (FORP) USP,1
FACULDADE GUARAI,1
CLINICA ALAMO HEALTHCARE,1
INSITUTO DO CORACAO,1
UNIFENAS/FUNDACAO DE ENSINO E TECNOLOGIA DE ALFENAS,1
CLINICA ELODONTO,1
SECRETARIA DE ESTADO DE TURISMO,1
FREITAS MACEDO ADVOGADOS ASSOCIADOS,1
SEDUCE GO,1
COMPANHIA DE GAS DA BAHIA,1
UNIVERSIDADE FEDERAL DE SAO CARLOS (CAMPUS - LAGOA DO SINO),1
UNIVERSIDADE DE SAO PAULO (USP\RP),1
GENERA - INOVACAO EM SAUDE,1
GRUPO DE ESTUDO E PESQUISA EM ATIVIDADE FISICA E EXERCICIO,1
UNIVERSIDADE DO SUL DE SANTA CATARINA CAMPUS PED RA BRANCA,1
INSTITUTO FEDERAL DO TRIANGULO MINEIRO - CAMPUS PATOS DE MINAS,1
ORGANIZACAO PARA A PESQUISA E A CONSERVACAO DE ESQUALOS NO BRASIL,1
CENTRO UNIVERSITARIO DE IPORA - UNIPORA,1
UNIVERSIDADE FEDERAL DO PIUAI,1
ISTITUTO DEI SISTEMI COMPLESSI,1
EXCELSU EDUCACIONAL,1
CENTRO DE ESTUDOS E ATENDIMENTOS PSICOLOGICO E  PSICOPEDAGOGICO,1
INSTITUTO PHYTUS CENTRO-NORTE,1
ESCOLA SUPERIOR DE CRICIUMA - FACULDADES ESUCRI,1
CENTRO VALERIA PASCHOAL DE EDUCACAO,1
SRH HOCHSCHULE FUR GESUNDHEIT,1
EMPRESA BRASILEIRA DE PESQUISA AGROPECUARIA EMBRAPA,1
PREFEITURA MUNICIPAL DO RIO GRANDE,1
VARELA & NEGREIROS ADVOGADOS ASSOCIADOS S/C,1
DUOS SOLUCOES EM TECNOLOGIA,1
INSTITUTO DO CEREBRO DE PERNAMBUCO,1
"UNIVERSIDADE ESTADUAL PAULISTA - CAMPUS BOTUCATU, UNESP/IBB",1
LIFE HORSE - MEDICINA EQUINA ESPORTIVA,1
FACULDADE DE TECNOLOGIA GAP,1
UNIVERSIDADE NACIONAL DE CORDOBA,1
INSTITUTO FEDERAL GOIANO - CAMPUS RIO VERDE  (GO),1
ROSANA MACHADO CONSULTORIA ADMINISTRATIVA,1
CENTRO UNIVERSITARIO FAESF,1
INSTITUTO DE INVESTIGACION BIOLOGICA DEL PARAGUAY,1
TECNOMYL,1
UNIVERSIDADE DE EXTREMADURA,1
"LEE, BROCK E CAMARGO ADVOGADOS",1
ONCOCENTER,1
"UNIVERSIDADE DE PERNAMBUCO, ESCOLA SUPERIOR DE EDUCACAO FISICA",1
SECRETARIA MUNICIPAL DA SAUDE DE RIBEIRAO PRETO,1
CENTRO DE ESTUDOS SUPERIORES DE IMPERATRIZ,1
CENTRO DE NEUROPSICOLOGIA APLICADA,1
COLEGIO DA POLICIA MILITAR UNIDADE CARLOS CUNHA FILHO,1
UNIVERSIDADE FEDERAL DOS VALES DO JEQUITINHONHA E MUCURI - CAMPUS I,1
INSTITUTO DO CORACAO (INCOR) - FMUSP,1
"DEPARTAMENTO DE MUSICA DA FACULDADE DE FILOSOFIA, CIENCIAS E LETRAS DE RP",1
PARQUE AGROTECNOLOGICO DO TOCANTINS,1
POLICINICA SAO RAFAEL,1
"INSTUTO FEDERAL DE EDUCACAO, CIENCIA E TECNOLOGIA DO SERTAO PERNAMBUCANO",1
NILO FRANTZ MEDICINA REPRODUTIVA,1
FACULDADE DE ENFERMAGEM DE FORMIGA,1
SISTEMA DE ENSINO ENERGIA,1
PREFEITURA MUNICIPAL DE APARECIDA,1
CENTRO DE APOIO PEDAGOGICO,1
CENTRO INTEGRADO DE NEUROPSICOLOGIA E PSICOLOGIA,1
NCDD TECNOLOGIA,1
HOSPITAL MUNICIPAL DR ROSY CURY,1
FACULDADE DE MEDICINA VETERINARIA E ZOOTECNIA DE BOTUCATU-UNESP,1
NUCLEO DE TECNOLOGIA EDUCACIONAL PARA A SAUDE,1
PARK EDUCATION,1
CONSORCIO CEDERJ UFF,1
UNIVERSIDADE DE PERNAMBUCO/CAMPUS PETROLINA,1
INSTITUTO ESTADUAL COUTO DE MAGALHAES,1
RODRIGO REIS RIBEIRO BASTOS- ADVOGADO,1
MIRSCIENCE THERAPEUTICS,1
CLINICA SPAZIO REVITA,1
INSTITUTO DE RADIOLOGIA DO HOSPITAL DAS CLINICAS DA FAC. DE MEDICINA DA USP,1
UNIVERSITY OF ILLINOIS URBANA-CHAMPAIGN,1
ESCOLA ESTADUAL DE ENSINO FUNDAMENTAL SANTOS DUMONT,1
HOSPITAL ODONTOLOGICO INSTITUTO CIRO MIGUITA,1
CENTRO DE INOVACAO CARGILL,1
FACULDADE DE TECNOLOGIA DE CRUZEIRO,1
ONCOLOGICA TAPAJOS,1
